"tm","opp","detail","quarter","time","down","togo","yds","epb","epa","exp_pts_diff","touchdown","field_goal_no_good","interception","fumble","pass","complete","incomplete","sack","rush","direction"
"Packers","Saints","Aaron Rodgers pass incomplete short left intended for Andrew Quarless is intercepted by David Hawthorne at NOR-2 and returned for 10 yards",3,"7M 46S",3,5,0,4.26,0.35,-3.91,FALSE,FALSE,TRUE,FALSE,TRUE,FALSE,TRUE,FALSE,FALSE,"left"
"Lions","Falcons","Theo Riddick right guard for 5 yards (tackle by Robert McClain)",3,"10S",1,7,5,5.6,5.72,0.12,FALSE,FALSE,FALSE,FALSE,FALSE,FALSE,FALSE,FALSE,TRUE,"right"
"Dolphins","Jaguars","Ryan Tannehill pass complete short left to Rishard Matthews for 3 yards touchdown",3,"2M 23S",1,3,3,6.51,7,0.49,TRUE,FALSE,FALSE,FALSE,TRUE,TRUE,FALSE,FALSE,FALSE,"left"
"Bills","Jets","Anthony Dixon right guard for -2 yards (tackle by Sheldon Richardson)",3,"1M 58S",2,9,-2,4.38,3.12,-1.26,FALSE,FALSE,FALSE,FALSE,FALSE,FALSE,FALSE,FALSE,TRUE,"right"
"Broncos","Chargers","Peyton Manning pass incomplete short right intended for Demaryius Thomas",3,"11M 2S",1,3,0,6.51,5.53,-0.98,FALSE,FALSE,FALSE,FALSE,TRUE,FALSE,TRUE,FALSE,FALSE,"right"
"Broncos","Chargers","Peyton Manning pass complete short left to Emmanuel Sanders for 3 yards touchdown",3,"10M 58S",2,3,3,5.53,7,1.47,TRUE,FALSE,FALSE,FALSE,TRUE,TRUE,FALSE,FALSE,FALSE,"left"
"Broncos","Chargers","Peyton Manning pass complete short left to Demaryius Thomas for 7 yards (tackle by Shareece Wright)",3,"8M 22S",1,9,7,5.14,5.72,0.58,FALSE,FALSE,FALSE,FALSE,TRUE,TRUE,FALSE,FALSE,FALSE,"right"
"Broncos","Chargers","Juwan Thompson up the middle for 2 yards touchdown",3,"7M 38S",2,2,2,5.72,7,1.28,TRUE,FALSE,FALSE,FALSE,FALSE,FALSE,FALSE,FALSE,TRUE,"middle"
"Ravens","Falcons","Joe Flacco pass incomplete short right intended for Justin Forsett",1,"12M 34S",1,6,0,5.83,4.95,-0.88,FALSE,FALSE,FALSE,FALSE,TRUE,FALSE,TRUE,FALSE,FALSE,"right"
"Ravens","Falcons","Justin Forsett right tackle for 1 yard (tackle by Joplo Bartu and Paul Worrilow)",1,"12M 23S",2,6,1,4.95,4.26,-0.69,FALSE,FALSE,FALSE,FALSE,FALSE,FALSE,FALSE,FALSE,TRUE,"right"
"Ravens","Falcons","Joe Flacco pass complete short middle to Owen Daniels for 5 yards touchdown",1,"11M 52S",3,5,5,4.26,7,2.74,TRUE,FALSE,FALSE,FALSE,TRUE,TRUE,FALSE,FALSE,FALSE,"middle"
"Broncos","49ers","Ronnie Hillman right guard for -3 yards (tackle by Ahmad Brooks)",1,"9M 48S",1,3,-3,6.51,4.95,-1.56,FALSE,FALSE,FALSE,FALSE,FALSE,FALSE,FALSE,FALSE,TRUE,"right"
"Broncos","49ers","Peyton Manning pass complete short left to Ronnie Hillman for 3 yards (tackle by Chris Borland and Dontae Johnson)",1,"9M 12S",2,6,3,4.95,4.72,-0.23,FALSE,FALSE,FALSE,FALSE,TRUE,TRUE,FALSE,FALSE,FALSE,"left"
"Broncos","49ers","Peyton Manning pass complete short left to Emmanuel Sanders for 3 yards touchdown",1,"8M 34S",3,3,3,4.72,7,2.28,TRUE,FALSE,FALSE,FALSE,TRUE,TRUE,FALSE,FALSE,FALSE,"left"
"Rams","Seahawks","Tre Mason up the middle for 6 yards touchdown",1,"5M 25S",1,6,6,5.83,7,1.17,TRUE,FALSE,FALSE,FALSE,FALSE,FALSE,FALSE,FALSE,TRUE,"middle"
"Packers","Panthers","Eddie Lacy right end for 5 yards touchdown",1,"5M 58S",1,5,5,6.06,7,0.94,TRUE,FALSE,FALSE,FALSE,FALSE,FALSE,FALSE,FALSE,TRUE,"right"
"Cardinals","Raiders","Stepfan Taylor right tackle for no gain (tackle by Charles Woodson and Khalil Mack)",1,"3M 13S",1,3,0,6.51,5.53,-0.98,FALSE,FALSE,FALSE,FALSE,FALSE,FALSE,FALSE,FALSE,TRUE,"right"
"Cardinals","Raiders","Stepfan Taylor right end for 1 yard (tackle by Carlos Rogers)",1,"2M 37S",2,3,1,5.53,4.95,-0.58,FALSE,FALSE,FALSE,FALSE,FALSE,FALSE,FALSE,FALSE,TRUE,"right"
"Cardinals","Raiders","Carson Palmer pass complete short right to Stepfan Taylor for 2 yards touchdown",1,"1M 52S",3,2,2,4.95,7,2.05,TRUE,FALSE,FALSE,FALSE,TRUE,TRUE,FALSE,FALSE,FALSE,"right"
"Chargers","Chiefs","Philip Rivers pass complete short right to John Phillips for 1 yard touchdown",1,"3M 19S",1,1,1,6.97,7,0.03,TRUE,FALSE,FALSE,FALSE,TRUE,TRUE,FALSE,FALSE,FALSE,"right"
"Rams","Seahawks","Tre Mason left tackle for -2 yards (tackle by Brandon Mebane). Penalty on Brian Quick: Unnecessary Roughness 15 yards",1,"1S",1,5,-2,6.06,2.73,-3.33,FALSE,FALSE,FALSE,FALSE,FALSE,FALSE,FALSE,FALSE,TRUE,"left"
"Colts","Bengals","Andrew Luck pass incomplete short left intended for Donte Moncrief (defended by Leon Hall)",1,"1M 54S",1,7,0,5.6,4.76,-0.84,FALSE,FALSE,FALSE,FALSE,TRUE,FALSE,TRUE,FALSE,FALSE,"left"
"Colts","Bengals","Andrew Luck left end for 2 yards (tackle by Vontaze Burfict)",1,"1M 51S",2,7,2,4.76,4.26,-0.5,FALSE,FALSE,FALSE,FALSE,FALSE,FALSE,FALSE,FALSE,TRUE,"left"
"Colts","Bengals","Andrew Luck sacked by Domata Peko for 0 yards",1,"1M 13S",3,5,0,4.26,3.01,-1.25,FALSE,FALSE,FALSE,FALSE,FALSE,FALSE,FALSE,TRUE,FALSE,NA
"Colts","Bengals","Adam Vinatieri 23 yard field goal good",1,"36S",4,5,NA,3.01,3,-0.01,FALSE,FALSE,FALSE,FALSE,FALSE,FALSE,FALSE,FALSE,FALSE,NA
"Dolphins","Bears","Lamar Miller left end for 7 yards (tackle by Will Sutton)",3,"1M 12S",1,9,7,5.14,5.72,0.58,FALSE,FALSE,FALSE,FALSE,FALSE,FALSE,FALSE,FALSE,TRUE,"left"
"Dolphins","Bears","Lamar Miller left end for 2 yards touchdown",3,"36S",2,2,2,5.72,7,1.28,TRUE,FALSE,FALSE,FALSE,FALSE,FALSE,FALSE,FALSE,TRUE,"left"
"Lions","Saints","Joique Bell left tackle for 1 yard (tackle by Parys Haralson)",3,"6M 59S",1,2,1,6.74,5.91,-0.83,FALSE,FALSE,FALSE,FALSE,FALSE,FALSE,FALSE,FALSE,TRUE,"left"
"Lions","Saints","Joique Bell left end for 1 yard touchdown",3,"6M 24S",2,1,1,5.91,7,1.09,TRUE,FALSE,FALSE,FALSE,FALSE,FALSE,FALSE,FALSE,TRUE,"left"
"Cardinals","Raiders","Stepfan Taylor left end for 4 yards touchdown",3,"3M 0S",1,4,4,6.28,7,0.72,TRUE,FALSE,FALSE,FALSE,FALSE,FALSE,FALSE,FALSE,TRUE,"left"
"Jets","Patriots","Nick Folk 22 yard field goal good",1,"6M 33S",4,4,NA,3.03,3,-0.03,FALSE,FALSE,FALSE,FALSE,FALSE,FALSE,FALSE,FALSE,FALSE,NA
"Jets","Patriots","Geno Smith pass complete short right to Chris Ivory for 7 yards (tackle by Jamie Collins)",3,"9M 30S",1,8,7,5.37,5.91,0.54,FALSE,FALSE,FALSE,FALSE,TRUE,TRUE,FALSE,FALSE,FALSE,"right"
"Jets","Patriots","Chris Ivory up the middle for 1 yard touchdown",3,"9M 2S",2,1,1,5.91,7,1.09,TRUE,FALSE,FALSE,FALSE,FALSE,FALSE,FALSE,FALSE,TRUE,"middle"
"Rams","49ers","Zac Stacy right guard for -1 yards (tackle by Ian Williams)",1,"10M 13S",1,5,-1,6.06,4.95,-1.11,FALSE,FALSE,FALSE,FALSE,FALSE,FALSE,FALSE,FALSE,TRUE,"right"
"Rams","49ers","Zac Stacy right tackle for -1 yards (tackle by Michael Wilhoite and Ray McDonald)",1,"9M 22S",1,3,-1,6.51,5.34,-1.17,FALSE,FALSE,FALSE,FALSE,FALSE,FALSE,FALSE,FALSE,TRUE,"right"
"Rams","49ers","Austin Davis pass complete short left to Austin Pettis for 3 yards (tackle by Jimmie Ward)",1,"8M 44S",2,4,3,5.34,5.17,-0.17,FALSE,FALSE,FALSE,FALSE,TRUE,TRUE,FALSE,FALSE,FALSE,"left"
"Rams","49ers","Benny Cunningham left end for 1 yard touchdown",1,"8M 1S",3,1,1,5.17,7,1.83,TRUE,FALSE,FALSE,FALSE,FALSE,FALSE,FALSE,FALSE,TRUE,"left"
"Jaguars","Titans","Storm Johnson left end for 1 yard (tackle by Blidi Wreh-Wilson)",1,"12M 11S",1,7,1,5.6,4.95,-0.65,FALSE,FALSE,FALSE,FALSE,FALSE,FALSE,FALSE,FALSE,TRUE,"left"
"Lions","Vikings","Joique Bell right tackle for no gain (tackle by Gerald Hodges)",1,"11M 53S",1,9,0,5.14,4.38,-0.76,FALSE,FALSE,FALSE,FALSE,FALSE,FALSE,FALSE,FALSE,TRUE,"right"
"Lions","Vikings","Matthew Stafford pass complete short right to Theo Riddick for 9 yards touchdown",1,"11M 11S",2,9,9,4.38,7,2.62,TRUE,FALSE,FALSE,FALSE,TRUE,TRUE,FALSE,FALSE,FALSE,"right"
"Jaguars","Titans","Storm Johnson right guard for 1 yard touchdown",1,"11M 23S",1,1,1,6.97,7,0.03,TRUE,FALSE,FALSE,FALSE,FALSE,FALSE,FALSE,FALSE,TRUE,"right"
"Packers","Dolphins","Aaron Rodgers pass complete short middle to Jordy Nelson for 9 yards touchdown",1,"10M 13S",1,9,9,5.14,7,1.86,TRUE,FALSE,FALSE,FALSE,TRUE,TRUE,FALSE,FALSE,FALSE,"middle"
"Panthers","Bengals","Darrin Reaves right end for 5 yards (tackle by Devon Still)",1,"7M 18S",1,9,5,5.14,5.34,0.2,FALSE,FALSE,FALSE,FALSE,FALSE,FALSE,FALSE,FALSE,TRUE,"right"
"Panthers","Bengals","Darrin Reaves up the middle for 1 yard (tackle by Wallace Gilberry and Rey Maualuga)",1,"6M 35S",2,4,1,5.34,4.72,-0.62,FALSE,FALSE,FALSE,FALSE,FALSE,FALSE,FALSE,FALSE,TRUE,"middle"
"Steelers","Browns","Le'Veon Bell left guard for 2 yards (tackle by Armonty Bryant)",1,"7M 14S",1,7,2,5.6,5.15,-0.45,FALSE,FALSE,FALSE,FALSE,FALSE,FALSE,FALSE,FALSE,TRUE,"left"
"Panthers","Bengals","Cam Newton pass complete short middle to Kelvin Benjamin for 3 yards touchdown",1,"5M 53S",3,3,3,4.72,7,2.28,TRUE,FALSE,FALSE,FALSE,TRUE,TRUE,FALSE,FALSE,FALSE,"middle"
"Steelers","Browns","Le'Veon Bell right guard for 2 yards (tackle by Donte Whitner and Desmond Bryant)",1,"6M 43S",2,5,2,5.15,4.72,-0.43,FALSE,FALSE,FALSE,FALSE,FALSE,FALSE,FALSE,FALSE,TRUE,"right"
"Ravens","Buccaneers","Justin Forsett right end for -1 yards (tackle by Lavonte David)",1,"10M 8S",1,8,-1,5.37,4.38,-0.99,FALSE,FALSE,FALSE,FALSE,FALSE,FALSE,FALSE,FALSE,TRUE,"right"
"Steelers","Browns","LeGarrette Blount right tackle for 1 yard (tackle by Craig Robertson)",1,"5M 59S",3,3,1,4.72,3.25,-1.47,FALSE,FALSE,FALSE,FALSE,FALSE,FALSE,FALSE,FALSE,TRUE,"right"
"Ravens","Buccaneers","Joe Flacco pass incomplete short middle intended for Owen Daniels",1,"9M 33S",2,9,0,4.38,3.36,-1.02,FALSE,FALSE,FALSE,FALSE,TRUE,FALSE,TRUE,FALSE,FALSE,"middle"
"Ravens","Buccaneers","Joe Flacco pass complete short middle to Torrey Smith for 9 yards touchdown",1,"9M 28S",3,9,9,3.36,7,3.64,TRUE,FALSE,FALSE,FALSE,TRUE,TRUE,FALSE,FALSE,FALSE,"middle"
"Steelers","Browns","Shaun Suisham 20 yard field goal good",1,"5M 12S",4,2,NA,3.25,3,-0.25,FALSE,FALSE,FALSE,FALSE,FALSE,FALSE,FALSE,FALSE,FALSE,NA
"Jets","Broncos","Chris Ivory right guard for 1 yard (tackle by Derek Wolfe and Von Miller)",1,"4M 55S",1,3,1,6.51,5.72,-0.79,FALSE,FALSE,FALSE,FALSE,FALSE,FALSE,FALSE,FALSE,TRUE,"right"
"Jets","Broncos","Geno Smith pass complete short left to Jace Amaro for 2 yards touchdown",1,"4M 21S",2,2,2,5.72,7,1.28,TRUE,FALSE,FALSE,FALSE,TRUE,TRUE,FALSE,FALSE,FALSE,"left"
"Cowboys","Seahawks","DeMarco Murray left guard for 3 yards (tackle by Marcus Burley and Brandon Mebane)",1,"3M 21S",1,5,3,6.06,5.72,-0.34,FALSE,FALSE,FALSE,FALSE,FALSE,FALSE,FALSE,FALSE,TRUE,"left"
"Cowboys","Seahawks","Tony Romo pass incomplete short left intended for Gavin Escobar (defended by Byron Maxwell)",1,"2M 41S",2,2,0,5.72,4.95,-0.77,FALSE,FALSE,FALSE,FALSE,TRUE,FALSE,TRUE,FALSE,FALSE,"left"
"Cowboys","Seahawks","Tony Romo pass complete short middle to Gavin Escobar for 2 yards touchdown",1,"2M 38S",3,2,2,4.95,7,2.05,TRUE,FALSE,FALSE,FALSE,TRUE,TRUE,FALSE,FALSE,FALSE,"middle"
"Titans","Jaguars","Charlie Whitehurst pass complete short left to Dexter McCluster for 5 yards (tackle by Jonathan Cyprien and Geno Hayes)",1,"2M 11S",2,8,5,4.57,4.72,0.15,FALSE,FALSE,FALSE,FALSE,TRUE,TRUE,FALSE,FALSE,FALSE,"left"
"Dolphins","Packers","Knowshon Moreno left guard for 3 yards (tackle by Micah Hyde)",1,"2M 57S",1,4,3,6.28,5.91,-0.37,FALSE,FALSE,FALSE,FALSE,FALSE,FALSE,FALSE,FALSE,TRUE,"left"
"Titans","Jaguars","Charlie Whitehurst sacked by Evander Hood for -4 yards",1,"1M 31S",3,3,-4,4.72,2.97,-1.75,FALSE,FALSE,FALSE,FALSE,FALSE,FALSE,FALSE,TRUE,FALSE,NA
"Dolphins","Packers","Knowshon Moreno up the middle for no gain (tackle by Letroy Guion)",1,"2M 37S",2,1,0,5.91,5.17,-0.74,FALSE,FALSE,FALSE,FALSE,FALSE,FALSE,FALSE,FALSE,TRUE,"middle"
"Titans","Jaguars","Ryan Succop 25 yard field goal good",1,"49S",4,7,NA,2.97,3,0.03,FALSE,FALSE,FALSE,FALSE,FALSE,FALSE,FALSE,FALSE,FALSE,NA
"Dolphins","Packers","Ryan Tannehill pass incomplete short middle intended for Brian Hartline (defended by Davon House)",1,"2M 5S",3,1,0,5.17,3.55,-1.62,FALSE,FALSE,FALSE,FALSE,TRUE,FALSE,TRUE,FALSE,FALSE,"middle"
"Dolphins","Packers","Knowshon Moreno up the middle for -2 yards (tackle by Morgan Burnett and Jamari Lattimore)",1,"2M 1S",4,1,-2,3.55,0.38,-3.17,FALSE,FALSE,FALSE,FALSE,FALSE,FALSE,FALSE,FALSE,TRUE,"middle"
"Lions","Bears","Matthew Stafford pass complete short middle to Tim Wright for 9 yards touchdown",1,"10M 19S",1,9,9,5.14,7,1.86,TRUE,FALSE,FALSE,FALSE,TRUE,TRUE,FALSE,FALSE,FALSE,"middle"
"Redskins","Cowboys","Kirk Cousins pass complete short left to Ryan Grant for 5 yards touchdown",1,"9M 14S",1,5,5,6.06,7,0.94,TRUE,FALSE,FALSE,FALSE,TRUE,TRUE,FALSE,FALSE,FALSE,"left"
"Seahawks","Cardinals","Christine Michael middle for no gain (tackle by Kevin Minter)",1,"6M 44S",1,1,0,6.97,5.91,-1.06,FALSE,FALSE,FALSE,FALSE,FALSE,FALSE,FALSE,FALSE,TRUE,"middle"
"Steelers","Browns","Ben Roethlisberger pass complete short middle to DeAngelo Williams for 6 yards (tackle by Christian Kirksey). Penalty on Xavier Cooper: Defensive Offside (Declined)",1,"7M 42S",1,8,6,5.37,5.72,0.35,FALSE,FALSE,FALSE,FALSE,TRUE,TRUE,FALSE,FALSE,FALSE,"middle"
"Seahawks","Cardinals","Russell Wilson right tackle for no gain (tackle by Tony Jefferson)",1,"6M 7S",2,1,0,5.91,5.17,-0.74,FALSE,FALSE,FALSE,FALSE,FALSE,FALSE,FALSE,FALSE,TRUE,"right"
"Steelers","Browns","Ben Roethlisberger pass complete short middle to Heath Miller for 2 yards touchdown",1,"7M 12S",2,2,2,5.72,7,1.28,TRUE,FALSE,FALSE,FALSE,TRUE,TRUE,FALSE,FALSE,FALSE,"middle"
"Seahawks","Cardinals","Bryce Brown middle for 1 yard touchdown",1,"5M 26S",3,1,1,5.17,7,1.83,TRUE,FALSE,FALSE,FALSE,FALSE,FALSE,FALSE,FALSE,TRUE,"middle"
"Texans","Jaguars","Brian Hoyer pass complete short right to Jaelen Strong for 2 yards (tackle by Paul Posluszny)",1,"6M 26S",1,8,2,5.37,4.95,-0.42,FALSE,FALSE,FALSE,FALSE,TRUE,TRUE,FALSE,FALSE,FALSE,"right"
"Saints","Falcons","Tim Hightower right tackle for 3 yards (tackle by Paul Worrilow and Ricardo Allen)",1,"4M 38S",1,7,3,5.6,5.34,-0.26,FALSE,FALSE,FALSE,FALSE,FALSE,FALSE,FALSE,FALSE,TRUE,"right"
"Saints","Falcons","Drew Brees pass incomplete short left intended for Josh Hill",1,"4M 0S",2,4,0,5.34,4.49,-0.85,FALSE,FALSE,FALSE,FALSE,TRUE,FALSE,TRUE,FALSE,FALSE,"left"
"Saints","Falcons","Tim Hightower right guard for 1 yard touchdown",1,"3M 19S",2,1,1,5.91,7,1.09,TRUE,FALSE,FALSE,FALSE,FALSE,FALSE,FALSE,FALSE,TRUE,"right"
"Giants","Eagles","Shane Vereen right guard for 2 yards (tackle by Mychal Kendricks and Marcus Smith)",1,"5M 4S",1,5,2,6.06,5.53,-0.53,FALSE,FALSE,FALSE,FALSE,FALSE,FALSE,FALSE,FALSE,TRUE,"right"
"Giants","Eagles","Eli Manning pass incomplete short left intended for Myles White (defended by Walter Thurmond)",1,"4M 23S",2,3,0,5.53,4.72,-0.81,FALSE,FALSE,FALSE,FALSE,TRUE,FALSE,TRUE,FALSE,FALSE,"left"
"Titans","Colts","Zach Mettenberger middle for 5 yards touchdown",1,"2M 25S",1,5,5,6.06,7,0.94,TRUE,FALSE,FALSE,FALSE,FALSE,FALSE,FALSE,FALSE,TRUE,"middle"
"Chiefs","Raiders","Spencer Ware middle for 3 yards touchdown",1,"55S",1,3,3,6.51,7,0.49,TRUE,FALSE,FALSE,FALSE,FALSE,FALSE,FALSE,FALSE,TRUE,"middle"
"Giants","Eagles","Eli Manning pass incomplete short middle intended for Will Tye",1,"4M 16S",3,3,0,4.72,3.04,-1.68,FALSE,FALSE,FALSE,FALSE,TRUE,FALSE,TRUE,FALSE,FALSE,"middle"
"Browns","Steelers","Isaiah Crowell right tackle for -2 yards (tackle by William Gay)",1,"2M 5S",1,9,-2,5.14,4.02,-1.12,FALSE,FALSE,FALSE,FALSE,FALSE,FALSE,FALSE,FALSE,TRUE,"right"
"Giants","Eagles","Josh Brown 22 yard field goal good",1,"4M 10S",4,3,NA,3.04,3,-0.04,FALSE,FALSE,FALSE,FALSE,FALSE,FALSE,FALSE,FALSE,FALSE,NA
"Redskins","Cowboys","Kirk Cousins pass incomplete short right intended for Pierre Garcon",1,"35S",1,3,0,6.51,5.53,-0.98,FALSE,FALSE,FALSE,FALSE,TRUE,FALSE,TRUE,FALSE,FALSE,"right"
"Redskins","Cowboys","Kirk Cousins pass incomplete short left intended for Jamison Crowder",1,"29S",2,3,0,5.53,4.72,-0.81,FALSE,FALSE,FALSE,FALSE,TRUE,FALSE,TRUE,FALSE,FALSE,"left"
"Redskins","Cowboys","Kirk Cousins pass complete short left to Jamison Crowder for 3 yards touchdown",1,"24S",3,3,3,4.72,7,2.28,TRUE,FALSE,FALSE,FALSE,TRUE,TRUE,FALSE,FALSE,FALSE,"left"
"Eagles","Giants","Darren Sproles right end for 6 yards touchdown",1,"1M 44S",1,6,6,5.83,7,1.17,TRUE,FALSE,FALSE,FALSE,FALSE,FALSE,FALSE,FALSE,TRUE,"right"
"Patriots","Dolphins","Steven Jackson left tackle for 2 yards touchdown",3,"12M 37S",1,2,2,6.74,7,0.26,TRUE,FALSE,FALSE,FALSE,FALSE,FALSE,FALSE,FALSE,TRUE,"left"
"Browns","Steelers","Isaiah Crowell right end for 4 yards (tackle by Arthur Moats)",3,"13M 5S",1,9,4,5.14,5.15,0.01,FALSE,FALSE,FALSE,FALSE,FALSE,FALSE,FALSE,FALSE,TRUE,"right"
"Browns","Steelers","Austin Davis pass incomplete short right intended for Gary Barnidge",3,"12M 22S",2,5,0,5.15,4.26,-0.89,FALSE,FALSE,FALSE,FALSE,TRUE,FALSE,TRUE,FALSE,FALSE,"right"
"Browns","Steelers","Austin Davis pass incomplete short left intended for Gary Barnidge is intercepted by James Harrison at PIT--1 and returned for 6 yards",3,"12M 17S",3,5,0,4.26,0.38,-3.88,FALSE,FALSE,TRUE,FALSE,TRUE,FALSE,TRUE,FALSE,FALSE,"left"
"Bengals","Ravens","A.J. McCarron pass complete short right to A.J. Green for 5 yards touchdown",3,"11M 29S",1,5,5,6.06,7,0.94,TRUE,FALSE,FALSE,FALSE,TRUE,TRUE,FALSE,FALSE,FALSE,"right"
"Broncos","Chargers","C.J. Anderson right tackle for no gain (tackle by Donald Butler)",3,"5M 38S",1,1,0,6.97,5.91,-1.06,FALSE,FALSE,FALSE,FALSE,FALSE,FALSE,FALSE,FALSE,TRUE,"right"
"Broncos","Chargers","C.J. Anderson left guard for 1 yard touchdown",3,"5M 29S",2,1,1,5.91,7,1.09,TRUE,FALSE,FALSE,FALSE,FALSE,FALSE,FALSE,FALSE,TRUE,"left"
"Bengals","Broncos","Giovani Bernard middle for 2 yards (tackle by DeMarcus Ware and Danny Trevathan)",1,"8M 16S",1,7,2,5.6,5.15,-0.45,FALSE,FALSE,FALSE,FALSE,FALSE,FALSE,FALSE,FALSE,TRUE,"middle"
"Bengals","Broncos","A.J. McCarron pass incomplete short left intended for Jake Fisher",1,"7M 38S",2,5,0,5.15,4.26,-0.89,FALSE,FALSE,FALSE,FALSE,TRUE,FALSE,TRUE,FALSE,FALSE,"left"
"Bengals","Broncos","A.J. McCarron pass complete short right to A.J. Green for 5 yards touchdown",1,"7M 31S",3,5,5,4.26,7,2.74,TRUE,FALSE,FALSE,FALSE,TRUE,TRUE,FALSE,FALSE,FALSE,"right"
"49ers","Lions","Jarryd Hayne left tackle for no gain (tackle by Brandon Copeland)",1,"11M 4S",1,8,0,5.37,4.57,-0.8,FALSE,FALSE,FALSE,FALSE,FALSE,FALSE,FALSE,FALSE,TRUE,"left"
"Panthers","Falcons","Cam Newton left guard for 8 yards touchdown",1,"9M 23S",1,8,8,5.37,7,1.63,TRUE,FALSE,FALSE,FALSE,FALSE,FALSE,FALSE,FALSE,TRUE,"left"
"49ers","Lions","Blaine Gabbert pass complete short right to Vance McDonald for 1 yard touchdown",1,"9M 28S",1,1,1,6.97,7,0.03,TRUE,FALSE,FALSE,FALSE,TRUE,TRUE,FALSE,FALSE,FALSE,"right"
"Buccaneers","Bears","Doug Martin middle for 4 yards touchdown",1,"6M 34S",1,4,4,6.28,7,0.72,TRUE,FALSE,FALSE,FALSE,FALSE,FALSE,FALSE,FALSE,TRUE,"middle"
"Ravens","Steelers","Ryan Mallett pass incomplete short middle intended for Maxx Williams (defended by Brandon Boykin)",1,"4M 2S",2,8,0,4.57,3.58,-0.99,FALSE,FALSE,FALSE,FALSE,TRUE,FALSE,TRUE,FALSE,FALSE,"middle"
"Ravens","Steelers","Ryan Mallett pass complete short middle to Chris Matthews for 8 yards touchdown",1,"3M 58S",3,8,8,3.58,7,3.42,TRUE,FALSE,FALSE,FALSE,TRUE,TRUE,FALSE,FALSE,FALSE,"middle"
"Dolphins","Colts","Lamar Miller left end for -3 yards (tackle by Kendall Langford and Erik Walden)",1,"1M 44S",1,3,-3,6.51,4.95,-1.56,FALSE,FALSE,FALSE,FALSE,FALSE,FALSE,FALSE,FALSE,TRUE,"left"
"Dolphins","Colts","Ryan Tannehill pass incomplete short right intended for DeVante Parker",1,"1M 9S",2,6,0,4.95,4.04,-0.91,FALSE,FALSE,FALSE,FALSE,TRUE,FALSE,TRUE,FALSE,FALSE,"right"
"Dolphins","Colts","Ryan Tannehill pass incomplete short right intended for DeVante Parker is intercepted by Vontae Davis at IND--9",1,"59S",3,6,0,4.04,-0.28,-4.32,FALSE,FALSE,TRUE,FALSE,TRUE,FALSE,TRUE,FALSE,FALSE,"right"
"Bills","Cowboys","Karlos Williams middle for 1 yard touchdown",1,"51S",1,1,1,6.97,7,0.03,TRUE,FALSE,FALSE,FALSE,FALSE,FALSE,FALSE,FALSE,TRUE,"middle"
"Steelers","Ravens","DeAngelo Williams left guard for 1 yard touchdown. Penalty on Matt Spaeth: Unsportsmanlike Conduct 15 yards",3,"11M 26S",1,1,1,6.97,7,0.03,TRUE,FALSE,FALSE,FALSE,FALSE,FALSE,FALSE,FALSE,TRUE,"left"
"Eagles","Redskins","Ryan Mathews middle for 1 yard touchdown",1,"12M 10S",1,1,1,6.97,7,0.03,TRUE,FALSE,FALSE,FALSE,FALSE,FALSE,FALSE,FALSE,TRUE,"middle"
"Chargers","Raiders","Danny Woodhead middle for no gain (tackle by Khalil Mack and Taylor Mays)",1,"9M 52S",1,1,0,6.97,5.91,-1.06,FALSE,FALSE,FALSE,FALSE,FALSE,FALSE,FALSE,FALSE,TRUE,"middle"
"Chargers","Raiders","Donald Brown middle for 1 yard touchdown",1,"9M 13S",2,1,1,5.91,7,1.09,TRUE,FALSE,FALSE,FALSE,FALSE,FALSE,FALSE,FALSE,TRUE,"middle"
"Lions","Saints","Theo Riddick left guard for 3 yards (tackle by Kasim Edebali)",1,"8M 33S",1,4,3,6.28,5.91,-0.37,FALSE,FALSE,FALSE,FALSE,FALSE,FALSE,FALSE,FALSE,TRUE,"left"
"Lions","Saints","Matthew Stafford pass incomplete short right intended for Tim Wright",1,"8M 0S",2,1,0,5.91,5.17,-0.74,FALSE,FALSE,FALSE,FALSE,TRUE,FALSE,TRUE,FALSE,FALSE,"right"
"Lions","Saints","Matthew Stafford pass complete short right to Golden Tate for 1 yard touchdown",1,"7M 56S",3,1,1,5.17,7,1.83,TRUE,FALSE,FALSE,FALSE,TRUE,TRUE,FALSE,FALSE,FALSE,"right"
"Cardinals","Eagles","David Johnson right end for 6 yards (tackle by Brandon Graham)",1,"11M 25S",1,7,6,5.6,5.91,0.31,FALSE,FALSE,FALSE,FALSE,FALSE,FALSE,FALSE,FALSE,TRUE,"right"
"Cardinals","Eagles","David Johnson middle for 1 yard touchdown",1,"10M 47S",2,1,1,5.91,7,1.09,TRUE,FALSE,FALSE,FALSE,FALSE,FALSE,FALSE,FALSE,TRUE,"middle"
"Falcons","Jaguars","Matt Ryan pass complete short left to Devonta Freeman for 3 yards (tackle by Paul Posluszny)",1,"11M 35S",1,8,3,5.37,5.15,-0.22,FALSE,FALSE,FALSE,FALSE,TRUE,TRUE,FALSE,FALSE,FALSE,"left"
"Falcons","Jaguars","Devonta Freeman right end for 5 yards touchdown",1,"10M 55S",2,5,5,5.15,7,1.85,TRUE,FALSE,FALSE,FALSE,FALSE,FALSE,FALSE,FALSE,TRUE,"right"
"Redskins","Bills","Kirk Cousins pass complete short right to Jordan Reed for 3 yards touchdown",1,"9M 28S",1,3,3,6.51,7,0.49,TRUE,FALSE,FALSE,FALSE,TRUE,TRUE,FALSE,FALSE,FALSE,"right"
"Steelers","Broncos","DeAngelo Williams middle for 2 yards touchdown",1,"10M 21S",1,2,2,6.74,7,0.26,TRUE,FALSE,FALSE,FALSE,FALSE,FALSE,FALSE,FALSE,TRUE,"middle"
"Browns","Seahawks","Isaiah Crowell left tackle for 1 yard (tackle by Frank Clark)",1,"9M 28S",1,8,1,5.37,4.76,-0.61,FALSE,FALSE,FALSE,FALSE,FALSE,FALSE,FALSE,FALSE,TRUE,"left"
"Browns","Seahawks","Isaiah Crowell left tackle for no gain (tackle by Michael Bennett)",1,"8M 52S",2,7,0,4.76,3.81,-0.95,FALSE,FALSE,FALSE,FALSE,FALSE,FALSE,FALSE,FALSE,TRUE,"left"
"Browns","Seahawks","Johnny Manziel pass complete short left to Gary Barnidge for 7 yards touchdown",1,"8M 13S",3,7,7,3.81,7,3.19,TRUE,FALSE,FALSE,FALSE,TRUE,TRUE,FALSE,FALSE,FALSE,"left"
"Ravens","Chiefs","Jimmy Clausen pass incomplete short right intended for Javorius Allen",1,"7M 20S",1,4,0,6.28,5.34,-0.94,FALSE,FALSE,FALSE,FALSE,TRUE,FALSE,TRUE,FALSE,FALSE,"right"
"Ravens","Chiefs","Javorius Allen right tackle for 3 yards (tackle by Jaye Howard and Derrick Johnson)",1,"7M 12S",2,4,3,5.34,5.17,-0.17,FALSE,FALSE,FALSE,FALSE,FALSE,FALSE,FALSE,FALSE,TRUE,"right"
"Ravens","Chiefs","Jimmy Clausen pass complete short left to Kyle Juszczyk for 1 yard touchdown",1,"6M 35S",3,1,1,5.17,7,1.83,TRUE,FALSE,FALSE,FALSE,TRUE,TRUE,FALSE,FALSE,FALSE,"left"
"Panthers","Giants","Cameron Artis-Payne right guard for -2 yards (tackle by Jonathan Casillas)",1,"6M 54S",1,1,-2,6.97,5.53,-1.44,FALSE,FALSE,FALSE,FALSE,FALSE,FALSE,FALSE,FALSE,TRUE,"right"
"Panthers","Giants","Mike Tolbert middle for no gain (tackle by Cullen Jenkins and Montori Hughes)",1,"6M 20S",2,3,0,5.53,4.72,-0.81,FALSE,FALSE,FALSE,FALSE,FALSE,FALSE,FALSE,FALSE,TRUE,"middle"
"Panthers","Giants","Cam Newton pass complete short left to Ted Ginn for 3 yards touchdown",1,"5M 41S",3,3,3,4.72,7,2.28,TRUE,FALSE,FALSE,FALSE,TRUE,TRUE,FALSE,FALSE,FALSE,"left"
"Packers","Raiders","Aaron Rodgers pass incomplete short left intended for Jeff Janis",1,"5M 18S",1,5,0,6.06,5.15,-0.91,FALSE,FALSE,FALSE,FALSE,TRUE,FALSE,TRUE,FALSE,FALSE,"left"
"Packers","Raiders","John Kuhn middle for 5 yards touchdown",1,"5M 12S",2,5,5,5.15,7,1.85,TRUE,FALSE,FALSE,FALSE,FALSE,FALSE,FALSE,FALSE,TRUE,"middle"
"Seahawks","Browns","Derrick Coleman right tackle for -2 yards (tackle by Danny Shelton)",1,"1M 36S",1,1,-2,6.97,5.53,-1.44,FALSE,FALSE,FALSE,FALSE,FALSE,FALSE,FALSE,FALSE,TRUE,"right"
"Seahawks","Browns","Russell Wilson pass incomplete short left intended for Cooper Helfet",1,"53S",2,3,0,5.53,4.72,-0.81,FALSE,FALSE,FALSE,FALSE,TRUE,FALSE,TRUE,FALSE,FALSE,"left"
"Seahawks","Browns","Russell Wilson pass complete short left to Doug Baldwin for 3 yards touchdown",1,"47S",3,3,3,4.72,7,2.28,TRUE,FALSE,FALSE,FALSE,TRUE,TRUE,FALSE,FALSE,FALSE,"left"
"Raiders","Packers","Latavius Murray left end for no gain (tackle by Mike Neal)",1,"1M 21S",1,6,0,5.83,4.95,-0.88,FALSE,FALSE,FALSE,FALSE,FALSE,FALSE,FALSE,FALSE,TRUE,"left"
"Raiders","Packers","Latavius Murray left guard for 1 yard (tackle by Letroy Guion)",1,"34S",2,6,1,4.95,4.26,-0.69,FALSE,FALSE,FALSE,FALSE,FALSE,FALSE,FALSE,FALSE,TRUE,"left"
"Jaguars","Falcons","Blake Bortles pass complete short left to Denard Robinson for 4 yards (tackle by Justin Durant)",3,"11M 31S",1,8,4,5.37,5.34,-0.03,FALSE,FALSE,FALSE,FALSE,TRUE,TRUE,FALSE,FALSE,FALSE,"left"
"Jaguars","Falcons","Blake Bortles pass incomplete short right intended for Allen Hurns",3,"10M 55S",2,4,0,5.34,4.49,-0.85,FALSE,FALSE,FALSE,FALSE,TRUE,FALSE,TRUE,FALSE,FALSE,"right"
"Jaguars","Falcons","Blake Bortles left end for 1 yard touchdown",3,"10M 47S",1,1,1,6.97,7,0.03,TRUE,FALSE,FALSE,FALSE,FALSE,FALSE,FALSE,FALSE,TRUE,"left"
"Cardinals","Eagles","David Johnson left guard for 1 yard touchdown",3,"9M 53S",1,1,1,6.97,7,0.03,TRUE,FALSE,FALSE,FALSE,FALSE,FALSE,FALSE,FALSE,TRUE,"left"
"Steelers","Broncos","Ben Roethlisberger pass complete short right to Antonio Brown for 9 yards touchdown",3,"7M 20S",1,9,9,5.14,7,1.86,TRUE,FALSE,FALSE,FALSE,TRUE,TRUE,FALSE,FALSE,FALSE,"right"
