"tm","opp","detail","quarter","time","down","togo","yds","epb","epa","exp_pts_diff","touchdown","field_goal_no_good","interception","fumble","pass","complete","incomplete","sack","rush","direction"
"Seahawks","Giants","Marshawn Lynch left guard for 4 yards (tackle by Justin Tuck)",3,"10M 11S",1,6,4,5.83,5.72,-0.11,FALSE,FALSE,FALSE,FALSE,FALSE,FALSE,FALSE,FALSE,TRUE,"left"
"Seahawks","Giants","Marshawn Lynch right tackle for 1 yard (tackle by Mark Herzlich and Johnathan Hankins)",3,"9M 36S",2,2,1,5.72,5.17,-0.55,FALSE,FALSE,FALSE,FALSE,FALSE,FALSE,FALSE,FALSE,TRUE,"right"
"Vikings","Eagles","Matt Cassel pass complete short middle to Matt Asiata for 2 yards (tackle by Bennie Logan)",3,"12M 40S",1,8,2,5.37,4.95,-0.42,FALSE,FALSE,FALSE,FALSE,TRUE,TRUE,FALSE,FALSE,FALSE,"middle"
"Browns","Bears","Edwin Baker left guard for 2 yards touchdown",3,"8M 24S",1,2,2,6.74,7,0.26,TRUE,FALSE,FALSE,FALSE,FALSE,FALSE,FALSE,FALSE,TRUE,"left"
"Seahawks","Giants","Russell Wilson pass incomplete short left intended for Zach Miller",3,"8M 57S",3,1,0,5.17,3.55,-1.62,FALSE,FALSE,FALSE,FALSE,TRUE,FALSE,TRUE,FALSE,FALSE,"left"
"Vikings","Eagles","Matt Cassel up the middle for 6 yards touchdown",3,"12M 7S",2,6,6,4.95,7,2.05,TRUE,FALSE,FALSE,FALSE,FALSE,FALSE,FALSE,FALSE,TRUE,"middle"
"Titans","Cardinals","Ryan Fitzpatrick pass complete short left to Kendall Wright for 4 yards (tackle by Daryl Washington)",3,"7M 23S",1,9,4,5.14,5.15,0.01,FALSE,FALSE,FALSE,FALSE,TRUE,TRUE,FALSE,FALSE,FALSE,"right"
"Seahawks","Giants","Steven Hauschka 24 yard field goal good",3,"8M 50S",4,6,NA,2.99,3,0.01,FALSE,FALSE,FALSE,FALSE,FALSE,FALSE,FALSE,FALSE,FALSE,NA
"Titans","Cardinals","Ryan Fitzpatrick pass incomplete short left intended for Delanie Walker (defended by Yeremiah Bell)",3,"6M 32S",2,5,0,5.15,4.26,-0.89,FALSE,FALSE,FALSE,FALSE,TRUE,FALSE,TRUE,FALSE,FALSE,"left"
"Titans","Cardinals","Ryan Fitzpatrick pass complete short middle to Delanie Walker for 1 yard touchdown",3,"6M 20S",1,1,1,6.97,7,0.03,TRUE,FALSE,FALSE,FALSE,TRUE,TRUE,FALSE,FALSE,FALSE,"middle"
"Jets","Panthers","Sheldon Richardson up the middle for 1 yard (tackle by Michael Mitchell and Chase Blackburn)",3,"4M 10S",1,2,1,6.74,5.91,-0.83,FALSE,FALSE,FALSE,FALSE,FALSE,FALSE,FALSE,FALSE,TRUE,"middle"
"Falcons","Redskins","Steven Jackson left end for 2 yards (tackle by E.J. Biggers and Perry Riley)",3,"10M 9S",1,8,2,5.37,4.95,-0.42,FALSE,FALSE,FALSE,FALSE,FALSE,FALSE,FALSE,FALSE,TRUE,"left"
"Jets","Panthers","Sheldon Richardson up the middle for 1 yard touchdown",3,"3M 23S",2,1,1,5.91,7,1.09,TRUE,FALSE,FALSE,FALSE,FALSE,FALSE,FALSE,FALSE,TRUE,"middle"
"Falcons","Redskins","Matt Ryan pass incomplete short right intended for Steven Jackson",3,"9M 31S",2,6,0,4.95,4.04,-0.91,FALSE,FALSE,FALSE,FALSE,TRUE,FALSE,TRUE,FALSE,FALSE,"right"
"Falcons","Redskins","Matt Ryan pass complete short right to Tony Gonzalez for 5 yards (tackle by Josh Wilson)",3,"9M 27S",3,6,5,4.04,3.55,-0.49,FALSE,FALSE,FALSE,FALSE,TRUE,TRUE,FALSE,FALSE,FALSE,"right"
"Cardinals","Titans","Rashard Mendenhall right guard for 1 yard (tackle by Akeem Ayers and Jurrell Casey)",3,"2M 58S",1,7,1,5.6,4.95,-0.65,FALSE,FALSE,FALSE,FALSE,FALSE,FALSE,FALSE,FALSE,TRUE,"right"
"Falcons","Redskins","Steven Jackson right tackle for no gain (tackle by Perry Riley)",3,"8M 34S",4,1,0,3.55,0.38,-3.17,FALSE,FALSE,FALSE,FALSE,FALSE,FALSE,FALSE,FALSE,TRUE,"right"
"Cardinals","Titans","Carson Palmer pass complete short middle to Jake Ballard for 6 yards touchdown",3,"2M 20S",2,6,6,4.95,7,2.05,TRUE,FALSE,FALSE,FALSE,TRUE,TRUE,FALSE,FALSE,FALSE,"middle"
"Falcons","Redskins","Steven Jackson right guard for 2 yards touchdown",3,"8M 16S",1,2,2,6.74,7,0.26,TRUE,FALSE,FALSE,FALSE,FALSE,FALSE,FALSE,FALSE,TRUE,"right"
"Dolphins","Patriots","Lamar Miller left guard for 3 yards (tackle by Dont'a Hightower)",3,"31S",1,5,3,6.06,5.72,-0.34,FALSE,FALSE,FALSE,FALSE,FALSE,FALSE,FALSE,FALSE,TRUE,"left"
"Chiefs","Raiders","Alex Smith pass complete short middle to Sean McGrath for 6 yards touchdown",3,"1M 24S",1,6,6,5.83,7,1.17,TRUE,FALSE,FALSE,FALSE,TRUE,TRUE,FALSE,FALSE,FALSE,"middle"
"Eagles","Vikings","Nick Foles pass complete short left to Zach Ertz for 3 yards touchdown",3,"19S",1,3,3,6.51,7,0.49,TRUE,FALSE,FALSE,FALSE,TRUE,TRUE,FALSE,FALSE,FALSE,"left"
"Cowboys","Bears","Tony Romo pass incomplete short middle intended for Jason Witten",1,"9M 11S",1,2,0,6.74,5.72,-1.02,FALSE,FALSE,FALSE,FALSE,TRUE,FALSE,TRUE,FALSE,FALSE,"middle"
"Cowboys","Bears","Tony Romo pass complete short left to Dez Bryant for 2 yards touchdown",1,"9M 6S",2,2,2,5.72,7,1.28,TRUE,FALSE,FALSE,FALSE,TRUE,TRUE,FALSE,FALSE,FALSE,"left"
"Bears","Cowboys","Matt Forte left guard for -1 yards (tackle by Nick Hayden)",1,"3M 0S",1,4,-1,6.28,5.15,-1.13,FALSE,FALSE,FALSE,FALSE,FALSE,FALSE,FALSE,FALSE,TRUE,"left"
"Bears","Cowboys","Michael Bush right tackle for 1 yard (tackle by Nick Hayden)",1,"2M 22S",2,5,1,5.15,4.49,-0.66,FALSE,FALSE,FALSE,FALSE,FALSE,FALSE,FALSE,FALSE,TRUE,"right"
"Bears","Cowboys","Josh McCown pass complete short left to Earl Bennett for 4 yards touchdown",1,"1M 40S",3,4,4,4.49,7,2.51,TRUE,FALSE,FALSE,FALSE,TRUE,TRUE,FALSE,FALSE,FALSE,"left"
"Bears","Cowboys","Matt Forte left guard for 3 yards (tackle by Kyle Wilber)",3,"3M 13S",1,7,3,5.6,5.34,-0.26,FALSE,FALSE,FALSE,FALSE,FALSE,FALSE,FALSE,FALSE,TRUE,"left"
"Bears","Cowboys","Josh McCown pass complete short right to Matt Forte for 4 yards touchdown",3,"2M 25S",2,4,4,5.34,7,1.66,TRUE,FALSE,FALSE,FALSE,TRUE,TRUE,FALSE,FALSE,FALSE,"right"
"Titans","Broncos","Shonn Greene up the middle for 1 yard touchdown",1,"12M 43S",1,1,1,6.97,7,0.03,TRUE,FALSE,FALSE,FALSE,FALSE,FALSE,FALSE,FALSE,TRUE,"middle"
"Cardinals","Rams","Rashard Mendenhall left end for 3 yards touchdown",1,"10M 36S",1,3,3,6.51,7,0.49,TRUE,FALSE,FALSE,FALSE,FALSE,FALSE,FALSE,FALSE,TRUE,"left"
"Broncos","Titans","Peyton Manning pass complete short left to Demaryius Thomas for 7 yards (tackle by Moise Fokou)",1,"8M 45S",1,8,7,5.37,5.91,0.54,FALSE,FALSE,FALSE,FALSE,TRUE,TRUE,FALSE,FALSE,FALSE,"left"
"Broncos","Titans","Peyton Manning pass complete short middle to Montee Ball for no gain",1,"8M 8S",2,1,NA,5.91,5.17,-0.74,FALSE,FALSE,FALSE,FALSE,TRUE,TRUE,FALSE,FALSE,FALSE,"middle"
"Broncos","Titans","Peyton Manning pass incomplete short right intended for Wes Welker (defended by Coty Sensabaugh)",1,"7M 37S",3,1,0,5.17,3.55,-1.62,FALSE,FALSE,FALSE,FALSE,TRUE,FALSE,TRUE,FALSE,FALSE,"right"
"Broncos","Titans","Peyton Manning pass complete short right to Wes Welker for 1 yard touchdown",1,"7M 33S",4,1,1,3.55,7,3.45,TRUE,FALSE,FALSE,FALSE,TRUE,TRUE,FALSE,FALSE,FALSE,"right"
"Chiefs","Redskins","Jamaal Charles right tackle for 2 yards touchdown",1,"5M 56S",1,2,2,6.74,7,0.26,TRUE,FALSE,FALSE,FALSE,FALSE,FALSE,FALSE,FALSE,TRUE,"right"
"Ravens","Vikings","Bernard Pierce left guard for 1 yard (tackle by Kevin Williams and Fred Evans)",1,"5M 35S",1,3,1,6.51,5.72,-0.79,FALSE,FALSE,FALSE,FALSE,FALSE,FALSE,FALSE,FALSE,TRUE,"left"
"Titans","Broncos","Chris Johnson up the middle for 3 yards touchdown",1,"7M 13S",1,3,3,6.51,7,0.49,TRUE,FALSE,FALSE,FALSE,FALSE,FALSE,FALSE,FALSE,TRUE,"middle"
"Ravens","Vikings","Bernard Pierce right guard for 1 yard (tackle by Chris Cook)",1,"5M 2S",2,2,1,5.72,5.17,-0.55,FALSE,FALSE,FALSE,FALSE,FALSE,FALSE,FALSE,FALSE,TRUE,"right"
"Ravens","Vikings","Joe Flacco pass complete short right to Ed Dickson for 1 yard touchdown",1,"4M 20S",3,1,1,5.17,7,1.83,TRUE,FALSE,FALSE,FALSE,TRUE,TRUE,FALSE,FALSE,FALSE,"right"
"Panthers","Saints","Cam Newton pass incomplete short right intended for Greg Olsen",1,"2M 4S",3,6,0,4.04,2.99,-1.05,FALSE,FALSE,FALSE,FALSE,TRUE,FALSE,TRUE,FALSE,FALSE,"right"
"Panthers","Saints","Graham Gano 24 yard field goal good",1,"1M 59S",4,6,NA,2.99,3,0.01,FALSE,FALSE,FALSE,FALSE,FALSE,FALSE,FALSE,FALSE,FALSE,NA
"Packers","Falcons","Eddie Lacy right guard for 1 yard (tackle by Corey Peters)",1,"1M 22S",1,8,1,5.37,4.76,-0.61,FALSE,FALSE,FALSE,FALSE,FALSE,FALSE,FALSE,FALSE,TRUE,"right"
"Packers","Falcons","Matt Flynn pass complete short middle to Eddie Lacy for 6 yards (tackle by Malliciah Goodman and Jonathan Babineaux)",1,"42S",2,7,6,4.76,5.17,0.41,FALSE,FALSE,FALSE,FALSE,TRUE,TRUE,FALSE,FALSE,FALSE,"middle"
"Packers","Falcons","Eddie Lacy right guard for 1 yard touchdown",1,"1S",3,1,1,5.17,7,1.83,TRUE,FALSE,FALSE,FALSE,FALSE,FALSE,FALSE,FALSE,TRUE,"right"
"Broncos","Titans","Peyton Manning pass incomplete short left intended for Demaryius Thomas",1,"43S",1,2,0,6.74,5.72,-1.02,FALSE,FALSE,FALSE,FALSE,TRUE,FALSE,TRUE,FALSE,FALSE,"left"
"Broncos","Titans","Peyton Manning pass incomplete short right intended for Wes Welker",1,"40S",2,7,0,4.76,3.81,-0.95,FALSE,FALSE,FALSE,FALSE,TRUE,FALSE,TRUE,FALSE,FALSE,"right"
"Broncos","Titans","Peyton Manning pass incomplete short left intended for Demaryius Thomas",1,"35S",3,7,0,3.81,2.97,-0.84,FALSE,FALSE,FALSE,FALSE,TRUE,FALSE,TRUE,FALSE,FALSE,"left"
"Broncos","Titans","Matt Prater 25 yard field goal good",1,"29S",4,7,NA,2.97,3,0.03,FALSE,FALSE,FALSE,FALSE,FALSE,FALSE,FALSE,FALSE,FALSE,NA
"Dolphins","Steelers","Daniel Thomas up the middle for 4 yards touchdown",3,"10M 53S",1,4,4,6.28,7,0.72,TRUE,FALSE,FALSE,FALSE,FALSE,FALSE,FALSE,FALSE,TRUE,"middle"
"Jets","Raiders","Geno Smith pass incomplete short middle intended for Kellen Winslow",3,"9M 24S",1,8,0,5.37,4.57,-0.8,FALSE,FALSE,FALSE,FALSE,TRUE,FALSE,TRUE,FALSE,FALSE,"middle"
"Jets","Raiders","Geno Smith left end for 8 yards touchdown",3,"9M 19S",2,8,8,4.57,7,2.43,TRUE,FALSE,FALSE,FALSE,FALSE,FALSE,FALSE,FALSE,TRUE,"left"
"Bengals","Colts","BenJarvus Green-Ellis right guard for 1 yard touchdown",3,"10M 45S",1,1,1,6.97,7,0.03,TRUE,FALSE,FALSE,FALSE,FALSE,FALSE,FALSE,FALSE,TRUE,"right"
"Broncos","Titans","Peyton Manning pass complete short middle to Demaryius Thomas for 4 yards touchdown",3,"11M 58S",1,4,4,6.28,7,0.72,TRUE,FALSE,FALSE,FALSE,TRUE,TRUE,FALSE,FALSE,FALSE,"middle"
"Broncos","Titans","Montee Ball right guard for no gain (tackle by Sammie Lee Hill)",3,"8M 27S",1,1,0,6.97,5.91,-1.06,FALSE,FALSE,FALSE,FALSE,FALSE,FALSE,FALSE,FALSE,TRUE,"right"
"Bengals","Colts","Andy Dalton pass complete short left to A.J. Green for 5 yards (tackle by Vontae Davis)",3,"3M 47S",1,6,5,5.83,5.91,0.08,FALSE,FALSE,FALSE,FALSE,TRUE,TRUE,FALSE,FALSE,FALSE,"left"
"Broncos","Titans","Peyton Manning pass incomplete short left intended for Joel Dreessen",3,"7M 50S",2,1,0,5.91,5.17,-0.74,FALSE,FALSE,FALSE,FALSE,TRUE,FALSE,TRUE,FALSE,FALSE,"left"
"Bengals","Colts","Andy Dalton pass complete short left to Jermaine Gresham for 1 yard touchdown",3,"3M 12S",2,1,1,5.91,7,1.09,TRUE,FALSE,FALSE,FALSE,TRUE,TRUE,FALSE,FALSE,FALSE,"left"
"Broncos","Titans","Peyton Manning pass incomplete short right intended for Andre Caldwell",3,"7M 42S",1,1,0,6.97,5.91,-1.06,FALSE,FALSE,FALSE,FALSE,TRUE,FALSE,TRUE,FALSE,FALSE,"right"
"Broncos","Titans","Knowshon Moreno up the middle for 1 yard touchdown",3,"7M 38S",2,1,1,5.91,7,1.09,TRUE,FALSE,FALSE,FALSE,FALSE,FALSE,FALSE,FALSE,TRUE,"middle"
"Jaguars","Texans","Chad Henne pass complete short middle to Maurice Jones-Drew for 5 yards (tackle by Jon Weeks and Darryl Sharpton)",1,"10M 5S",1,6,5,5.83,5.91,0.08,FALSE,FALSE,FALSE,FALSE,TRUE,TRUE,FALSE,FALSE,FALSE,"middle"
"Jaguars","Texans","Maurice Jones-Drew up the middle for no gain (tackle by D.J. Swearinger)",1,"9M 29S",2,1,0,5.91,5.17,-0.74,FALSE,FALSE,FALSE,FALSE,FALSE,FALSE,FALSE,FALSE,TRUE,"middle"
"Jaguars","Texans","Chad Henne pass complete short left to Marcedes Lewis for 1 yard touchdown",1,"8M 53S",3,1,1,5.17,7,1.83,TRUE,FALSE,FALSE,FALSE,TRUE,TRUE,FALSE,FALSE,FALSE,"left"
"Seahawks","Saints","Marshawn Lynch right tackle for 2 yards (tackle by Curtis Lofton and Akiem Hicks)",1,"3M 13S",1,4,2,6.28,5.72,-0.56,FALSE,FALSE,FALSE,FALSE,FALSE,FALSE,FALSE,FALSE,TRUE,"right"
"Seahawks","Saints","Marshawn Lynch left tackle for no gain (tackle by Ramon Humber and Curtis Lofton)",1,"2M 35S",2,2,0,5.72,4.95,-0.77,FALSE,FALSE,FALSE,FALSE,FALSE,FALSE,FALSE,FALSE,TRUE,"left"
"Seahawks","Saints","Russell Wilson pass complete short right to Zach Miller for 2 yards touchdown",1,"1M 58S",3,2,2,4.95,7,2.05,TRUE,FALSE,FALSE,FALSE,TRUE,TRUE,FALSE,FALSE,FALSE,"right"
"Eagles","Cardinals","Nick Foles pass complete short right to Zach Ertz for 6 yards touchdown",1,"12M 35S",1,6,6,5.83,7,1.17,TRUE,FALSE,FALSE,FALSE,TRUE,TRUE,FALSE,FALSE,FALSE,"right"
"Bills","Falcons","Fred Jackson left guard for 4 yards (tackle by Jonathan Babineaux and Joplo Bartu)",1,"11M 33S",1,6,4,5.83,5.72,-0.11,FALSE,FALSE,FALSE,FALSE,FALSE,FALSE,FALSE,FALSE,TRUE,"left"
"Browns","Jaguars","Chris Ogbonnaya up the middle for 4 yards (tackle by Josh Evans)",1,"11M 34S",1,5,4,6.06,5.91,-0.15,FALSE,FALSE,FALSE,FALSE,FALSE,FALSE,FALSE,FALSE,TRUE,"middle"
"Browns","Jaguars","Willis McGahee right guard for 1 yard touchdown",1,"10M 57S",2,1,1,5.91,7,1.09,TRUE,FALSE,FALSE,FALSE,FALSE,FALSE,FALSE,FALSE,TRUE,"right"
"Bills","Falcons","EJ Manuel right end for 1 yard touchdown",1,"10M 59S",2,1,1,5.91,7,1.09,TRUE,FALSE,FALSE,FALSE,FALSE,FALSE,FALSE,FALSE,TRUE,"right"
"Chiefs","Broncos","Alex Smith pass incomplete short middle intended for Anthony Fasano is intercepted by Wesley Woodyard at DEN--7",1,"8M 57S",1,2,0,6.74,-0.28,-7.02,FALSE,FALSE,TRUE,FALSE,TRUE,FALSE,TRUE,FALSE,FALSE,"middle"
"Redskins","Giants","Evan Royster left guard for no gain (tackle by Mark Herzlich)",1,"8M 36S",1,1,0,6.97,5.91,-1.06,FALSE,FALSE,FALSE,FALSE,FALSE,FALSE,FALSE,FALSE,TRUE,"left"
"Texans","Patriots","Case Keenum pass incomplete short right intended for Garrett Graham",1,"8M 53S",1,8,0,5.37,4.57,-0.8,FALSE,FALSE,FALSE,FALSE,TRUE,FALSE,TRUE,FALSE,FALSE,"right"
"Redskins","Giants","Alfred Morris up the middle for 1 yard touchdown",1,"8M 16S",2,1,1,5.91,7,1.09,TRUE,FALSE,FALSE,FALSE,FALSE,FALSE,FALSE,FALSE,TRUE,"middle"
"Texans","Patriots","Ben Tate right tackle for 8 yards touchdown",1,"8M 48S",2,8,8,4.57,7,2.43,TRUE,FALSE,FALSE,FALSE,FALSE,FALSE,FALSE,FALSE,TRUE,"right"
"Bills","Falcons","EJ Manuel left tackle for 1 yard (tackle by Sean Weatherspoon). Penalty on Robert McClain: Defensive Holding 4 yards",1,"5M 33S",2,9,1,4.38,6.28,1.9,FALSE,FALSE,FALSE,FALSE,FALSE,FALSE,FALSE,FALSE,TRUE,"left"
"Bills","Falcons","Fred Jackson up the middle for 4 yards touchdown",1,"5M 6S",1,4,4,6.28,7,0.72,TRUE,FALSE,FALSE,FALSE,FALSE,FALSE,FALSE,FALSE,TRUE,"middle"
"Patriots","Texans","James Develin up the middle for 1 yard touchdown",3,"12M 49S",1,1,1,6.97,7,0.03,TRUE,FALSE,FALSE,FALSE,FALSE,FALSE,FALSE,FALSE,TRUE,"middle"
"Vikings","Bears","Adrian Peterson right end for 2 yards (tackle by Chris Conte)",3,"9M 8S",1,8,2,5.37,4.95,-0.42,FALSE,FALSE,FALSE,FALSE,FALSE,FALSE,FALSE,FALSE,TRUE,"right"
"Vikings","Bears","Adrian Peterson right tackle for 2 yards (tackle by Jay Ratliff and Christian Tupou)",3,"8M 22S",2,6,2,4.95,4.49,-0.46,FALSE,FALSE,FALSE,FALSE,FALSE,FALSE,FALSE,FALSE,TRUE,"right"
"Patriots","Texans","Tom Brady pass complete short left to Shane Vereen for 9 yards touchdown",3,"8M 11S",1,9,9,5.14,7,1.86,TRUE,FALSE,FALSE,FALSE,TRUE,TRUE,FALSE,FALSE,FALSE,"left"
"Falcons","Bills","Steven Jackson right guard for no gain (tackle by Kiko Alonso and Stephon Gilmore)",3,"9M 37S",1,1,0,6.97,5.91,-1.06,FALSE,FALSE,FALSE,FALSE,FALSE,FALSE,FALSE,FALSE,TRUE,"right"
"Falcons","Bills","Matt Ryan sacked by Marcell Dareus for -5 yards",3,"9M 16S",2,1,-5,5.91,4.04,-1.87,FALSE,FALSE,FALSE,FALSE,FALSE,FALSE,FALSE,TRUE,FALSE,NA
"Jets","Dolphins","Bilal Powell up the middle for 3 yards (tackle by Dion Jordan)",3,"5M 54S",1,5,3,6.06,5.72,-0.34,FALSE,FALSE,FALSE,FALSE,FALSE,FALSE,FALSE,FALSE,TRUE,"middle"
"Jets","Dolphins","Matt Simms pass incomplete short right intended for Jeff Cumberland (defended by Reshad Jones)",3,"5M 21S",2,2,0,5.72,4.95,-0.77,FALSE,FALSE,FALSE,FALSE,TRUE,FALSE,TRUE,FALSE,FALSE,"right"
"Jets","Dolphins","Chris Ivory right tackle for no gain (tackle by Philip Wheeler and Chris Clemons)",3,"5M 18S",3,2,0,4.95,3.25,-1.7,FALSE,FALSE,FALSE,FALSE,FALSE,FALSE,FALSE,FALSE,TRUE,"right"
"Jets","Dolphins","Nick Folk 20 yard field goal good",3,"4M 33S",4,2,NA,3.25,3,-0.25,FALSE,FALSE,FALSE,FALSE,FALSE,FALSE,FALSE,FALSE,FALSE,NA
"Titans","Colts","Ryan Fitzpatrick up the middle for 1 yard (tackle by Jerrell Freeman and Pat Angerer)",3,"9M 13S",1,2,1,6.74,5.91,-0.83,FALSE,FALSE,FALSE,FALSE,FALSE,FALSE,FALSE,FALSE,TRUE,"middle"
"Titans","Colts","Shonn Greene up the middle for no gain (tackle by Antoine Bethea)",3,"8M 32S",2,1,0,5.91,5.17,-0.74,FALSE,FALSE,FALSE,FALSE,FALSE,FALSE,FALSE,FALSE,TRUE,"middle"
"Browns","Jaguars","Chris Ogbonnaya right guard for 5 yards (tackle by Paul Posluszny)",3,"10M 28S",1,9,5,5.14,5.34,0.2,FALSE,FALSE,FALSE,FALSE,FALSE,FALSE,FALSE,FALSE,TRUE,"right"
"Titans","Colts","Ryan Fitzpatrick up the middle for no gain (tackle by Kelvin Sheppard)",3,"8M 4S",3,1,0,5.17,3.55,-1.62,FALSE,FALSE,FALSE,FALSE,FALSE,FALSE,FALSE,FALSE,TRUE,"middle"
"Browns","Jaguars","Brandon Weeden pass complete short right to Greg Little for 4 yards touchdown",3,"9M 49S",2,4,4,5.34,7,1.66,TRUE,FALSE,FALSE,FALSE,TRUE,TRUE,FALSE,FALSE,FALSE,"right"
"Titans","Colts","Ryan Fitzpatrick pass complete short right to Chris Johnson for 1 yard touchdown",3,"7M 34S",4,1,1,3.55,7,3.45,TRUE,FALSE,FALSE,FALSE,TRUE,TRUE,FALSE,FALSE,FALSE,"right"
"Broncos","Chiefs","Peyton Manning pass complete short right to Knowshon Moreno for 4 yards (tackle by Frank Zombo)",3,"22S",1,8,4,5.37,5.34,-0.03,FALSE,FALSE,FALSE,FALSE,TRUE,TRUE,FALSE,FALSE,FALSE,"right"
"Ravens","Steelers","Ray Rice up the middle for no gain (tackle by Ryan Clark and Will Allen)",1,"10M 17S",1,1,0,6.97,5.91,-1.06,FALSE,FALSE,FALSE,FALSE,FALSE,FALSE,FALSE,FALSE,TRUE,"middle"
"Ravens","Steelers","Joe Flacco sacked by Jason Worilds for -6 yards",1,"9M 54S",2,1,-6,5.91,3.81,-2.1,FALSE,FALSE,FALSE,FALSE,FALSE,FALSE,FALSE,TRUE,FALSE,NA
"Ravens","Steelers","Joe Flacco pass complete short middle to Torrey Smith for 7 yards touchdown",1,"9M 23S",3,7,7,3.81,7,3.19,TRUE,FALSE,FALSE,FALSE,TRUE,TRUE,FALSE,FALSE,FALSE,"middle"
"Lions","Packers","Matthew Stafford pass incomplete short right intended for Joseph Fauria",1,"18S",1,7,0,5.6,4.76,-0.84,FALSE,FALSE,FALSE,FALSE,TRUE,FALSE,TRUE,FALSE,FALSE,"right"
"Cowboys","Raiders","DeMarco Murray left tackle for 2 yards touchdown",1,"47S",1,2,2,6.74,7,0.26,TRUE,FALSE,FALSE,FALSE,FALSE,FALSE,FALSE,FALSE,TRUE,"left"
"Steelers","Ravens","Ben Roethlisberger pass incomplete short middle intended for Emmanuel Sanders",3,"6M 44S",1,8,0,5.37,4.57,-0.8,FALSE,FALSE,FALSE,FALSE,TRUE,FALSE,TRUE,FALSE,FALSE,"middle"
"Steelers","Ravens","Ben Roethlisberger pass incomplete short left intended for Jerricho Cotchery (defended by Jimmy Smith)",3,"6M 41S",2,8,0,4.57,3.58,-0.99,FALSE,FALSE,FALSE,FALSE,TRUE,FALSE,TRUE,FALSE,FALSE,"left"
"Steelers","Ravens","Ben Roethlisberger pass complete short middle to Emmanuel Sanders for 8 yards touchdown",3,"6M 33S",3,8,8,3.58,7,3.42,TRUE,FALSE,FALSE,FALSE,TRUE,TRUE,FALSE,FALSE,FALSE,"middle"
"Cowboys","Raiders","Tony Romo pass complete short right to Dez Bryant for 4 yards touchdown",3,"5M 31S",1,4,4,6.28,7,0.72,TRUE,FALSE,FALSE,FALSE,TRUE,TRUE,FALSE,FALSE,FALSE,"right"
"49ers","Redskins","Colin Kaepernick pass complete short middle to Anquan Boldin for 6 yards touchdown",3,"9M 33S",1,6,6,5.83,7,1.17,TRUE,FALSE,FALSE,FALSE,TRUE,TRUE,FALSE,FALSE,FALSE,"middle"
"49ers","Redskins","Frank Gore left guard for 4 yards (tackle by London Fletcher and Reed Doughty)",3,"1M 50S",1,5,4,6.06,5.91,-0.15,FALSE,FALSE,FALSE,FALSE,FALSE,FALSE,FALSE,FALSE,TRUE,"left"
"49ers","Redskins","Colin Kaepernick pass complete short right to Vernon Davis for 1 yard touchdown",3,"1M 9S",2,1,1,5.91,7,1.09,TRUE,FALSE,FALSE,FALSE,TRUE,TRUE,FALSE,FALSE,FALSE,"right"
"Rams","Bears","Zac Stacy up the middle for 3 yards (tackle by Major Wright)",1,"13M 19S",1,7,3,5.6,5.34,-0.26,FALSE,FALSE,FALSE,FALSE,FALSE,FALSE,FALSE,FALSE,TRUE,"middle"
"Jaguars","Texans","Chad Henne pass complete short left to Cecil Shorts for 7 yards (tackle by Johnathan Joseph and Brandon Harris)",1,"11M 58S",1,8,7,5.37,5.91,0.54,FALSE,FALSE,FALSE,FALSE,TRUE,TRUE,FALSE,FALSE,FALSE,"left"
"Rams","Bears","Kellen Clemens pass incomplete short right intended for Lance Kendricks",1,"12M 51S",2,4,0,5.34,4.49,-0.85,FALSE,FALSE,FALSE,FALSE,TRUE,FALSE,TRUE,FALSE,FALSE,"right"
"Jaguars","Texans","Chad Henne up the middle for no gain (tackle by Justin Tuggle)",1,"11M 43S",2,1,0,5.91,5.17,-0.74,FALSE,FALSE,FALSE,FALSE,FALSE,FALSE,FALSE,FALSE,TRUE,"middle"
"Jaguars","Texans","Chad Henne pass incomplete short right intended for Will Ta'ufo'ou",1,"11M 8S",3,1,0,5.17,3.55,-1.62,FALSE,FALSE,FALSE,FALSE,TRUE,FALSE,TRUE,FALSE,FALSE,"right"
"Rams","Bears","Zac Stacy left guard for 1 yard touchdown",1,"12M 40S",1,1,1,6.97,7,0.03,TRUE,FALSE,FALSE,FALSE,FALSE,FALSE,FALSE,FALSE,TRUE,"left"
"Jaguars","Texans","Maurice Jones-Drew up the middle for 1 yard touchdown",1,"11M 3S",4,1,1,3.55,7,3.45,TRUE,FALSE,FALSE,FALSE,FALSE,FALSE,FALSE,FALSE,TRUE,"middle"
"Cardinals","Colts","Carson Palmer pass complete short left to Larry Fitzgerald for 4 yards touchdown",1,"10M 6S",1,4,4,6.28,7,0.72,TRUE,FALSE,FALSE,FALSE,TRUE,TRUE,FALSE,FALSE,FALSE,"left"
"Jets","Ravens","Josh Cribbs right guard for 1 yard (tackle by James Ihedigbo)",1,"7M 48S",1,9,1,5.14,4.57,-0.57,FALSE,FALSE,FALSE,FALSE,FALSE,FALSE,FALSE,FALSE,TRUE,"right"
"Jets","Ravens","Geno Smith pass incomplete short right intended for David Nelson",1,"7M 9S",2,8,0,4.57,3.58,-0.99,FALSE,FALSE,FALSE,FALSE,TRUE,FALSE,TRUE,FALSE,FALSE,"right"
"Jets","Ravens","Geno Smith pass incomplete short right intended for Bilal Powell",1,"7M 0S",3,8,0,3.58,2.95,-0.63,FALSE,FALSE,FALSE,FALSE,TRUE,FALSE,TRUE,FALSE,FALSE,"right"
"Jets","Ravens","Nick Folk 27 yard field goal good",1,"6M 56S",4,8,NA,2.95,3,0.05,FALSE,FALSE,FALSE,FALSE,FALSE,FALSE,FALSE,FALSE,FALSE,NA
"Broncos","Patriots","Knowshon Moreno right guard for 2 yards touchdown",1,"8M 58S",2,2,2,5.72,7,1.28,TRUE,FALSE,FALSE,FALSE,FALSE,FALSE,FALSE,FALSE,TRUE,"right"
"Packers","Vikings","Scott Tolzien pass incomplete short right intended for James Jones (defended by Xavier Rhodes)",1,"5M 10S",1,6,0,5.83,4.95,-0.88,FALSE,FALSE,FALSE,FALSE,TRUE,FALSE,TRUE,FALSE,FALSE,"right"
"Packers","Vikings","Scott Tolzien left tackle for 6 yards touchdown",1,"5M 6S",2,6,6,4.95,7,2.05,TRUE,FALSE,FALSE,FALSE,FALSE,FALSE,FALSE,FALSE,TRUE,"left"
"Bears","Rams","Josh McCown pass complete short middle to Earl Bennett for no gain",1,"7M 3S",1,7,NA,5.6,4.76,-0.84,FALSE,FALSE,FALSE,FALSE,TRUE,TRUE,FALSE,FALSE,FALSE,"middle"
"Bears","Rams","Josh McCown pass complete short right to Martellus Bennett for 7 yards touchdown",1,"6M 24S",2,7,7,4.76,7,2.24,TRUE,FALSE,FALSE,FALSE,TRUE,TRUE,FALSE,FALSE,FALSE,"right"
"Broncos","Patriots","Montee Ball up the middle for -1 yards (tackle by Chandler Jones and Rob Ninkovich)",1,"4M 51S",1,5,-1,6.06,4.95,-1.11,FALSE,FALSE,FALSE,FALSE,FALSE,FALSE,FALSE,FALSE,TRUE,"middle"
"Broncos","Patriots","Peyton Manning sacked by Chandler Jones for -10 yards",1,"4M 18S",2,6,-10,4.95,2.85,-2.1,FALSE,FALSE,FALSE,FALSE,FALSE,FALSE,FALSE,TRUE,FALSE,NA
"Rams","Bears","Benny Cunningham right tackle for no gain (tackle by Corey Wootton)",1,"2M 15S",1,6,0,5.83,4.95,-0.88,FALSE,FALSE,FALSE,FALSE,FALSE,FALSE,FALSE,FALSE,TRUE,"right"
"Broncos","Patriots","Matt Prater 27 yard field goal good",1,"3M 0S",4,9,NA,2.83,3,0.17,FALSE,FALSE,FALSE,FALSE,FALSE,FALSE,FALSE,FALSE,FALSE,NA
"Colts","Cardinals","Andrew Luck pass incomplete short left intended for Darrius Heyward-Bey",1,"1M 34S",2,9,0,4.38,3.36,-1.02,FALSE,FALSE,FALSE,FALSE,TRUE,FALSE,TRUE,FALSE,FALSE,"left"
"Rams","Bears","Kellen Clemens pass incomplete short left intended for Chris Givens",1,"1M 35S",2,6,0,4.95,4.04,-0.91,FALSE,FALSE,FALSE,FALSE,TRUE,FALSE,TRUE,FALSE,FALSE,"left"
"Colts","Cardinals","Andrew Luck pass incomplete short left intended for Darrius Heyward-Bey",1,"1M 29S",3,9,0,3.36,2.83,-0.53,FALSE,FALSE,FALSE,FALSE,TRUE,FALSE,TRUE,FALSE,FALSE,"left"
"Rams","Bears","Kellen Clemens pass complete short middle to Jared Cook for 6 yards touchdown",1,"1M 30S",3,6,6,4.04,7,2.96,TRUE,FALSE,FALSE,FALSE,TRUE,TRUE,FALSE,FALSE,FALSE,"middle"
"Colts","Cardinals","Adam Vinatieri 27 yard field goal good",1,"1M 19S",4,9,NA,2.83,3,0.17,FALSE,FALSE,FALSE,FALSE,FALSE,FALSE,FALSE,FALSE,FALSE,NA
"Chargers","Chiefs","Ryan Mathews up the middle for 1 yard touchdown",3,"12M 20S",1,1,1,6.97,7,0.03,TRUE,FALSE,FALSE,FALSE,FALSE,FALSE,FALSE,FALSE,TRUE,"middle"
"Texans","Jaguars","Dennis Johnson right guard for 4 yards (tackle by Geno Hayes)",3,"9M 56S",1,8,4,5.37,5.34,-0.03,FALSE,FALSE,FALSE,FALSE,FALSE,FALSE,FALSE,FALSE,TRUE,"right"
"Texans","Jaguars","Dennis Johnson up the middle for 2 yards (tackle by Geno Hayes)",3,"9M 19S",2,4,2,5.34,4.95,-0.39,FALSE,FALSE,FALSE,FALSE,FALSE,FALSE,FALSE,FALSE,TRUE,"middle"
"Texans","Jaguars","Case Keenum pass incomplete short right intended for DeAndre Hopkins",3,"8M 33S",3,2,0,4.95,3.25,-1.7,FALSE,FALSE,FALSE,FALSE,TRUE,FALSE,TRUE,FALSE,FALSE,"right"
"Texans","Jaguars","Randy Bullock 20 yard field goal good",3,"8M 29S",4,2,NA,3.25,3,-0.25,FALSE,FALSE,FALSE,FALSE,FALSE,FALSE,FALSE,FALSE,FALSE,NA
"Chiefs","Chargers","Alex Smith pass incomplete short right intended for Jamaal Charles",3,"9M 13S",1,2,0,6.74,5.72,-1.02,FALSE,FALSE,FALSE,FALSE,TRUE,FALSE,TRUE,FALSE,FALSE,"right"
"Bears","Rams","Josh McCown pass incomplete short right intended for Michael Bush",3,"9M 14S",1,4,0,6.28,5.34,-0.94,FALSE,FALSE,FALSE,FALSE,TRUE,FALSE,TRUE,FALSE,FALSE,"right"
"Chiefs","Chargers","Jamaal Charles up the middle for 1 yard touchdown",3,"9M 4S",1,1,1,6.97,7,0.03,TRUE,FALSE,FALSE,FALSE,FALSE,FALSE,FALSE,FALSE,TRUE,"middle"
"Bears","Rams","Josh McCown pass incomplete short left intended for Alshon Jeffery (defended by Janoris Jenkins)",3,"9M 8S",2,4,0,5.34,4.49,-0.85,FALSE,FALSE,FALSE,FALSE,TRUE,FALSE,TRUE,FALSE,FALSE,"left"
