"tm","opp","detail","quarter","time","down","togo","yds","epb","epa","exp_pts_diff","touchdown","field_goal_no_good","interception","fumble","pass","complete","incomplete","sack","rush","direction"
"Texans","Jaguars","Derrick Ward right tackle for 4 yards (tackle by Don Carey and Kirk Morrison)",1,"13M 2S",1,6,4,5.83,5.72,-0.11,FALSE,FALSE,FALSE,FALSE,FALSE,FALSE,FALSE,FALSE,TRUE,"right"
"Seahawks","Rams","Charlie Whitehurst pass complete short right to Golden Tate for 3 yards (tackle by Ronald Bartell)",1,"12M 12S",1,7,3,5.6,5.34,-0.26,FALSE,FALSE,FALSE,FALSE,TRUE,TRUE,FALSE,FALSE,FALSE,"right"
"Texans","Jaguars","Arian Foster right guard for 2 yards touchdown",1,"12M 29S",2,2,2,5.72,7,1.28,TRUE,FALSE,FALSE,FALSE,FALSE,FALSE,FALSE,FALSE,TRUE,"right"
"Seahawks","Rams","Charlie Whitehurst pass complete short left to Mike Williams for 4 yards touchdown",1,"11M 43S",2,4,4,5.34,7,1.66,TRUE,FALSE,FALSE,FALSE,TRUE,TRUE,FALSE,FALSE,FALSE,"left"
"Ravens","Bengals","Ray Rice left guard for 3 yards (tackle by Robert Geathers and Rey Maualuga)",1,"11M 45S",1,9,3,5.14,4.95,-0.19,FALSE,FALSE,FALSE,FALSE,FALSE,FALSE,FALSE,FALSE,TRUE,"left"
"Ravens","Bengals","Ray Rice left guard for -1 yards (tackle by Keith Rivers)",1,"11M 4S",2,6,-1,4.95,3.81,-1.14,FALSE,FALSE,FALSE,FALSE,FALSE,FALSE,FALSE,FALSE,TRUE,"left"
"Ravens","Bengals","Joe Flacco pass incomplete short left intended for Ray Rice. Penalty on Ray Rice: Offensive Pass Interfere (Declined)",1,"10M 23S",3,7,0,3.81,2.97,-0.84,FALSE,FALSE,FALSE,FALSE,TRUE,FALSE,TRUE,FALSE,FALSE,"left"
"Ravens","Bengals","Billy Cundiff 25 yard field goal good",1,"10M 13S",4,7,NA,2.97,3,0.03,FALSE,FALSE,FALSE,FALSE,FALSE,FALSE,FALSE,FALSE,FALSE,NA
"Falcons","Panthers","Michael Turner left end for 3 yards (tackle by C.J. Wilson and Jon Beason)",1,"10M 57S",1,9,3,5.14,4.95,-0.19,FALSE,FALSE,FALSE,FALSE,FALSE,FALSE,FALSE,FALSE,TRUE,"left"
"Falcons","Panthers","Matt Ryan pass complete short left to Tony Gonzalez for 6 yards touchdown",1,"10M 11S",2,6,6,4.95,7,2.05,TRUE,FALSE,FALSE,FALSE,TRUE,TRUE,FALSE,FALSE,FALSE,"left"
"Giants","Redskins","Ahmad Bradshaw left tackle for no gain (tackle by Adam Carriker and Anthony Bryant)",1,"6M 40S",1,6,0,5.83,4.95,-0.88,FALSE,FALSE,FALSE,FALSE,FALSE,FALSE,FALSE,FALSE,TRUE,"left"
"Giants","Redskins","Eli Manning pass incomplete short middle intended for Derek Hagan (defended by Kevin Barnes)",1,"6M 4S",2,6,0,4.95,4.04,-0.91,FALSE,FALSE,FALSE,FALSE,TRUE,FALSE,TRUE,FALSE,FALSE,"middle"
"Giants","Redskins","Ahmad Bradshaw left guard for 4 yards (tackle by Brian Orakpo and London Fletcher)",1,"5M 58S",3,6,4,4.04,3.25,-0.79,FALSE,FALSE,FALSE,FALSE,FALSE,FALSE,FALSE,FALSE,TRUE,"left"
"Giants","Redskins","Lawrence Tynes 20 yard field goal good",1,"5M 8S",4,2,NA,3.25,3,-0.25,FALSE,FALSE,FALSE,FALSE,FALSE,FALSE,FALSE,FALSE,FALSE,NA
"Lions","Vikings","Shaun Hill pass complete short left to Tony Scheffler for 7 yards (tackle by Ben Leber). Tony Scheffler fumbles (forced by Ben Leber) recovered by Jamarca Sanford at MIN-0",1,"4M 28S",1,8,7,5.37,-0.28,-5.65,FALSE,FALSE,FALSE,TRUE,TRUE,TRUE,FALSE,FALSE,FALSE,"left"
"Steelers","Browns","Rashard Mendenhall right guard for 1 yard touchdown",1,"7M 0S",1,1,1,6.97,7,0.03,TRUE,FALSE,FALSE,FALSE,FALSE,FALSE,FALSE,FALSE,TRUE,"right"
"Saints","Buccaneers","Chris Ivory right end for 2 yards (tackle by Roy Miller and Barrett Ruud)",1,"5M 27S",1,6,2,5.83,5.34,-0.49,FALSE,FALSE,FALSE,FALSE,FALSE,FALSE,FALSE,FALSE,TRUE,"right"
"Saints","Buccaneers","Drew Brees pass incomplete short left intended for Lance Moore (defended by Ronde Barber)",1,"4M 49S",2,4,0,5.34,4.49,-0.85,FALSE,FALSE,FALSE,FALSE,TRUE,FALSE,TRUE,FALSE,FALSE,"left"
"Titans","Colts","Chris Johnson right tackle for 1 yard (tackle by Antonio Johnson)",1,"3M 20S",1,9,1,5.14,4.57,-0.57,FALSE,FALSE,FALSE,FALSE,FALSE,FALSE,FALSE,FALSE,TRUE,"right"
"Saints","Buccaneers","Drew Brees pass complete short right to Jimmy Graham for 4 yards touchdown",1,"4M 45S",3,4,4,4.49,7,2.51,TRUE,FALSE,FALSE,FALSE,TRUE,TRUE,FALSE,FALSE,FALSE,"right"
"Titans","Colts","Kerry Collins pass incomplete short left intended for Kenny Britt",1,"2M 43S",2,8,0,4.57,3.58,-0.99,FALSE,FALSE,FALSE,FALSE,TRUE,FALSE,TRUE,FALSE,FALSE,"left"
"Titans","Colts","Kerry Collins pass incomplete short left intended for Jared Cook",1,"2M 37S",3,8,0,3.58,2.95,-0.63,FALSE,FALSE,FALSE,FALSE,TRUE,FALSE,TRUE,FALSE,FALSE,"left"
"Titans","Colts","Rob Bironas 26 yard field goal good",1,"2M 32S",4,8,NA,2.95,3,0.05,FALSE,FALSE,FALSE,FALSE,FALSE,FALSE,FALSE,FALSE,FALSE,NA
"Patriots","Dolphins","BenJarvus Green-Ellis left tackle for 1 yard touchdown",1,"4M 15S",1,1,1,6.97,7,0.03,TRUE,FALSE,FALSE,FALSE,FALSE,FALSE,FALSE,FALSE,TRUE,"left"
"Eagles","Cowboys","Chad Hall middle for 2 yards (tackle by Bradie James)",1,"29S",1,6,2,5.83,5.34,-0.49,FALSE,FALSE,FALSE,FALSE,FALSE,FALSE,FALSE,FALSE,TRUE,"middle"
"Browns","Steelers","Colt McCoy pass complete short middle to Peyton Hillis for 3 yards (tackle by Casey Hampton)",1,"33S",1,5,3,6.06,5.72,-0.34,FALSE,FALSE,FALSE,FALSE,TRUE,TRUE,FALSE,FALSE,FALSE,"middle"
"Rams","Seahawks","Sam Bradford pass incomplete short middle intended for Laurent Robinson",3,"9M 8S",3,9,0,3.36,2.83,-0.53,FALSE,FALSE,FALSE,FALSE,TRUE,FALSE,TRUE,FALSE,FALSE,"middle"
"Rams","Seahawks","Josh Brown 27 yard field goal good",3,"9M 2S",4,9,NA,2.83,3,0.17,FALSE,FALSE,FALSE,FALSE,FALSE,FALSE,FALSE,FALSE,FALSE,NA
"Ravens","Bengals","Ray Rice middle for 7 yards touchdown",3,"5M 52S",2,7,7,4.76,7,2.24,TRUE,FALSE,FALSE,FALSE,FALSE,FALSE,FALSE,FALSE,TRUE,"middle"
"Packers","Bears","John Kuhn middle for no gain (tackle by Julius Peppers)",3,"4M 35S",1,1,0,6.97,5.91,-1.06,FALSE,FALSE,FALSE,FALSE,FALSE,FALSE,FALSE,FALSE,TRUE,"middle"
"49ers","Cardinals","Alex Smith pass incomplete short middle intended for Vernon Davis (defended by Paris Lenon)",3,"9M 14S",1,6,0,5.83,4.95,-0.88,FALSE,FALSE,FALSE,FALSE,TRUE,FALSE,TRUE,FALSE,FALSE,"middle"
"Packers","Bears","Aaron Rodgers for no gain. Aaron Rodgers fumbles recovered by Brandon Jackson at CHI-8 and returned for 5 yards",3,"3M 53S",2,1,0,5.91,4.72,-1.19,FALSE,FALSE,FALSE,TRUE,FALSE,FALSE,FALSE,FALSE,TRUE,NA
"49ers","Cardinals","Brian Westbrook middle for 6 yards touchdown",3,"9M 7S",2,6,6,4.95,7,2.05,TRUE,FALSE,FALSE,FALSE,FALSE,FALSE,FALSE,FALSE,TRUE,"middle"
"Texans","Jaguars","Arian Foster left end for no gain (tackle by Russell Allen and Terrance Knighton)",3,"4M 38S",1,5,0,6.06,5.15,-0.91,FALSE,FALSE,FALSE,FALSE,FALSE,FALSE,FALSE,FALSE,TRUE,"left"
"Packers","Bears","Aaron Rodgers sacked by Tommie Harris for -2 yards",3,"3M 9S",3,3,-2,4.72,3.01,-1.71,FALSE,FALSE,FALSE,FALSE,FALSE,FALSE,FALSE,TRUE,FALSE,NA
"Texans","Jaguars","Matt Schaub pass incomplete short right intended for Kevin Walter",3,"4M 0S",2,5,0,5.15,4.26,-0.89,FALSE,FALSE,FALSE,FALSE,TRUE,FALSE,TRUE,FALSE,FALSE,"right"
"Packers","Bears","Mason Crosby 23 yard field goal good",3,"2M 43S",4,5,NA,3.01,3,-0.01,FALSE,FALSE,FALSE,FALSE,FALSE,FALSE,FALSE,FALSE,FALSE,NA
"Texans","Jaguars","Matt Schaub pass complete short middle to Owen Daniels for 5 yards touchdown",3,"3M 52S",3,5,5,4.26,7,2.74,TRUE,FALSE,FALSE,FALSE,TRUE,TRUE,FALSE,FALSE,FALSE,"middle"
"Chiefs","Raiders","Thomas Jones middle for 3 yards (tackle by Lamarr Houston)",3,"8M 52S",1,8,3,5.37,5.15,-0.22,FALSE,FALSE,FALSE,FALSE,FALSE,FALSE,FALSE,FALSE,TRUE,"middle"
"Chiefs","Raiders","Matt Cassel pass incomplete",3,"8M 11S",2,5,0,5.15,4.26,-0.89,FALSE,FALSE,FALSE,FALSE,TRUE,FALSE,TRUE,FALSE,FALSE,NA
"Chiefs","Raiders","Jamaal Charles middle for 5 yards touchdown",3,"8M 5S",3,5,5,4.26,7,2.74,TRUE,FALSE,FALSE,FALSE,FALSE,FALSE,FALSE,FALSE,TRUE,"middle"
"Eagles","Vikings","Michael Vick pass complete short right to Brent Celek for no gain",1,"8M 27S",1,3,NA,6.51,5.53,-0.98,FALSE,FALSE,FALSE,FALSE,TRUE,TRUE,FALSE,FALSE,FALSE,"right"
"Eagles","Vikings","Michael Vick pass complete short middle to Clay Harbor for 3 yards touchdown",1,"7M 47S",2,3,3,5.53,7,1.47,TRUE,FALSE,FALSE,FALSE,TRUE,TRUE,FALSE,FALSE,FALSE,"middle"
"Vikings","Eagles","Adrian Peterson middle for -1 yards (tackle by Jamar Chaney). Penalty on Dimitri Patterson: Unnecessary Roughness 3 yards",3,"13M 40S",1,5,-1,6.06,6.51,0.45,FALSE,FALSE,FALSE,FALSE,FALSE,FALSE,FALSE,FALSE,TRUE,"middle"
"Vikings","Eagles","Adrian Peterson middle for 1 yard (tackle by Quintin Mikell)",3,"13M 32S",1,3,1,6.51,5.72,-0.79,FALSE,FALSE,FALSE,FALSE,FALSE,FALSE,FALSE,FALSE,TRUE,"middle"
"Vikings","Eagles","Joe Webb pass incomplete short left intended for Sidney Rice (defended by Asante Samuel)",3,"12M 50S",2,2,0,5.72,4.95,-0.77,FALSE,FALSE,FALSE,FALSE,TRUE,FALSE,TRUE,FALSE,FALSE,"left"
"Vikings","Eagles","Joe Webb sacked by Juqua Parker for -10 yards",3,"12M 46S",3,2,-10,4.95,2.63,-2.32,FALSE,FALSE,FALSE,FALSE,FALSE,FALSE,FALSE,TRUE,FALSE,NA
"Vikings","Eagles","Joe Webb pass complete short left to Percy Harvin for -5 yards (tackle by Kurt Coleman)",3,"7M 55S",1,4,-5,6.28,4.38,-1.9,FALSE,FALSE,FALSE,FALSE,TRUE,TRUE,FALSE,FALSE,FALSE,"left"
"Vikings","Eagles","Joe Webb right end for 9 yards touchdown",3,"7M 12S",2,9,9,4.38,7,2.62,TRUE,FALSE,FALSE,FALSE,FALSE,FALSE,FALSE,FALSE,TRUE,"right"
"Falcons","Saints","Michael Turner right guard for no gain (tackle by Remi Ayodele and Roman Harper)",3,"11M 39S",1,1,0,6.97,5.91,-1.06,FALSE,FALSE,FALSE,FALSE,FALSE,FALSE,FALSE,FALSE,TRUE,"right"
"Falcons","Saints","Michael Turner middle for -1 yards (tackle by Jeff Charleston and Marvin Mitchell). Michael Turner fumbles (forced by Jeff Charleston) recovered by Marvin Mitchell at NOR-2",3,"11M 5S",2,1,-1,5.91,0.38,-5.53,FALSE,FALSE,FALSE,TRUE,FALSE,FALSE,FALSE,FALSE,TRUE,"middle"
"Rams","49ers","Steven Jackson middle for 1 yard touchdown",1,"11M 26S",1,1,1,6.97,7,0.03,TRUE,FALSE,FALSE,FALSE,FALSE,FALSE,FALSE,FALSE,TRUE,"middle"
"Redskins","Jaguars","Ryan Torain middle for 4 yards (tackle by Austen Lane)",1,"10M 47S",1,7,4,5.6,5.53,-0.07,FALSE,FALSE,FALSE,FALSE,FALSE,FALSE,FALSE,FALSE,TRUE,"middle"
"Redskins","Jaguars","Ryan Torain middle for 2 yards (tackle by Jeremy Mincey)",1,"10M 7S",2,3,2,5.53,5.17,-0.36,FALSE,FALSE,FALSE,FALSE,FALSE,FALSE,FALSE,FALSE,TRUE,"middle"
"Redskins","Jaguars","Rex Grossman pass incomplete short middle intended for Chris Cooley",1,"9M 18S",1,1,0,6.97,5.91,-1.06,FALSE,FALSE,FALSE,FALSE,TRUE,FALSE,TRUE,FALSE,FALSE,"middle"
"Redskins","Jaguars","Rex Grossman pass complete short left to Fred Davis for 1 yard touchdown",1,"9M 13S",2,1,1,5.91,7,1.09,TRUE,FALSE,FALSE,FALSE,TRUE,TRUE,FALSE,FALSE,FALSE,"left"
"Seahawks","Buccaneers","Marshawn Lynch middle for no gain (tackle by Sean Jones and Al Woods)",1,"4M 17S",1,1,0,6.97,5.91,-1.06,FALSE,FALSE,FALSE,FALSE,FALSE,FALSE,FALSE,FALSE,TRUE,"middle"
"Texans","Broncos","Arian Foster right end for 3 yards touchdown",1,"2M 48S",1,3,3,6.51,7,0.49,TRUE,FALSE,FALSE,FALSE,FALSE,FALSE,FALSE,FALSE,TRUE,"right"
"Seahawks","Buccaneers","Marshawn Lynch middle for no gain (tackle by Geno Hayes and Frank Okam)",1,"3M 36S",2,1,0,5.91,5.17,-0.74,FALSE,FALSE,FALSE,FALSE,FALSE,FALSE,FALSE,FALSE,TRUE,"middle"
"Colts","Raiders","Joseph Addai right guard for 6 yards touchdown",1,"6M 4S",1,6,6,5.83,7,1.17,TRUE,FALSE,FALSE,FALSE,FALSE,FALSE,FALSE,FALSE,TRUE,"right"
"Seahawks","Buccaneers","Matt Hasselbeck right end for 1 yard touchdown",1,"2M 59S",3,1,1,5.17,7,1.83,TRUE,FALSE,FALSE,FALSE,FALSE,FALSE,FALSE,FALSE,TRUE,"right"
"Chiefs","Titans","Thomas Jones left end for 2 yards (tackle by Jason Babin)",1,"2M 40S",1,7,2,5.6,5.15,-0.45,FALSE,FALSE,FALSE,FALSE,FALSE,FALSE,FALSE,FALSE,TRUE,"left"
"Chiefs","Titans","Matt Cassel pass complete short right to Jamaal Charles for 5 yards touchdown",1,"1M 59S",2,5,5,5.15,7,1.85,TRUE,FALSE,FALSE,FALSE,TRUE,TRUE,FALSE,FALSE,FALSE,"right"
"Packers","Giants","Brandon Jackson right tackle for 3 yards (tackle by Rocky Bernard)",1,"2M 40S",1,6,3,5.83,5.53,-0.3,FALSE,FALSE,FALSE,FALSE,FALSE,FALSE,FALSE,FALSE,TRUE,"right"
"Packers","Giants","Aaron Rodgers pass incomplete short left intended for Greg Jennings",1,"1M 58S",2,3,0,5.53,4.72,-0.81,FALSE,FALSE,FALSE,FALSE,TRUE,FALSE,TRUE,FALSE,FALSE,"left"
"Packers","Giants","Aaron Rodgers pass complete short right to James Jones for 3 yards touchdown",1,"1M 53S",3,3,3,4.72,7,2.28,TRUE,FALSE,FALSE,FALSE,TRUE,TRUE,FALSE,FALSE,FALSE,"right"
"Lions","Dolphins","Maurice Morris left end for 5 yards touchdown",3,"5M 56S",1,5,5,6.06,7,0.94,TRUE,FALSE,FALSE,FALSE,FALSE,FALSE,FALSE,FALSE,TRUE,"left"
"Packers","Giants","Brandon Jackson right tackle for no gain (tackle by Chase Blackburn)",3,"5M 30S",1,1,0,6.97,5.91,-1.06,FALSE,FALSE,FALSE,FALSE,FALSE,FALSE,FALSE,FALSE,TRUE,"right"
"Packers","Giants","Aaron Rodgers pass complete short right to Donald Lee for 1 yard touchdown",3,"4M 49S",2,1,1,5.91,7,1.09,TRUE,FALSE,FALSE,FALSE,TRUE,TRUE,FALSE,FALSE,FALSE,"right"
"Dolphins","Lions","Ronnie Brown left guard for 1 yard touchdown",3,"19S",1,1,1,6.97,7,0.03,TRUE,FALSE,FALSE,FALSE,FALSE,FALSE,FALSE,FALSE,TRUE,"left"
"Bears","Vikings","Matt Forte left end for 1 yard (tackle by Husain Abdullah)",3,"14M 46S",1,6,1,5.83,5.15,-0.68,FALSE,FALSE,FALSE,FALSE,FALSE,FALSE,FALSE,FALSE,TRUE,"left"
"Bears","Vikings","Jay Cutler pass incomplete short right intended for Johnny Knox",3,"14M 19S",2,5,0,5.15,4.26,-0.89,FALSE,FALSE,FALSE,FALSE,TRUE,FALSE,TRUE,FALSE,FALSE,"right"
"Bears","Vikings","Jay Cutler pass incomplete short middle intended for Earl Bennett",3,"14M 13S",3,5,0,4.26,3.01,-1.25,FALSE,FALSE,FALSE,FALSE,TRUE,FALSE,TRUE,FALSE,FALSE,"middle"
"Bears","Vikings","Robbie Gould 23 yard field goal good",3,"14M 10S",4,5,NA,3.01,3,-0.01,FALSE,FALSE,FALSE,FALSE,FALSE,FALSE,FALSE,FALSE,FALSE,NA
"Bears","Vikings","Jay Cutler pass complete short middle to Rashied Davis for 9 yards touchdown",3,"5M 19S",1,9,9,5.14,7,1.86,TRUE,FALSE,FALSE,FALSE,TRUE,TRUE,FALSE,FALSE,FALSE,"middle"
"Colts","Jaguars","Peyton Manning pass complete short left to Austin Collie for 7 yards touchdown",1,"11M 28S",1,7,7,5.6,7,1.4,TRUE,FALSE,FALSE,FALSE,TRUE,TRUE,FALSE,FALSE,FALSE,"left"
"Titans","Texans","Chris Johnson left tackle for no gain (tackle by Jason Allen)",1,"11M 3S",1,3,0,6.51,5.53,-0.98,FALSE,FALSE,FALSE,FALSE,FALSE,FALSE,FALSE,FALSE,TRUE,"left"
"Titans","Texans","Kerry Collins pass complete short right to Nate Washington for 3 yards touchdown",1,"10M 25S",2,3,3,5.53,7,1.47,TRUE,FALSE,FALSE,FALSE,TRUE,TRUE,FALSE,FALSE,FALSE,"right"
"Seahawks","Falcons","Marshawn Lynch right tackle for 1 yard touchdown",1,"7M 32S",1,1,1,6.97,7,0.03,TRUE,FALSE,FALSE,FALSE,FALSE,FALSE,FALSE,FALSE,TRUE,"right"
"Cowboys","Redskins","Felix Jones middle for 3 yards (tackle by London Fletcher)",1,"8M 57S",1,4,3,6.28,5.91,-0.37,FALSE,FALSE,FALSE,FALSE,FALSE,FALSE,FALSE,FALSE,TRUE,"middle"
"Cowboys","Redskins","Jon Kitna pass incomplete short left intended for Miles Austin",1,"8M 22S",2,1,0,5.91,5.17,-0.74,FALSE,FALSE,FALSE,FALSE,TRUE,FALSE,TRUE,FALSE,FALSE,"left"
"Titans","Texans","Chris Johnson right end for -3 yards (tackle by Kevin Bentley)",1,"8M 15S",1,2,-3,6.74,5.15,-1.59,FALSE,FALSE,FALSE,FALSE,FALSE,FALSE,FALSE,FALSE,TRUE,"right"
"Cowboys","Redskins","Jon Kitna middle for 5 yards (tackle by Carlos Rogers)",1,"8M 17S",3,6,5,4.04,3.55,-0.49,FALSE,FALSE,FALSE,FALSE,FALSE,FALSE,FALSE,FALSE,TRUE,"middle"
"Cowboys","Redskins","Tashard Choice middle for -1 yards (tackle by London Fletcher and Rocky McIntosh)",1,"7M 34S",4,1,-1,3.55,0.38,-3.17,FALSE,FALSE,FALSE,FALSE,FALSE,FALSE,FALSE,FALSE,TRUE,"middle"
"Titans","Texans","Kerry Collins pass incomplete short left intended for Kenny Britt (defended by Damione Lewis)",1,"7M 23S",2,2,0,5.72,4.95,-0.77,FALSE,FALSE,FALSE,FALSE,TRUE,FALSE,TRUE,FALSE,FALSE,"left"
"Titans","Texans","Chris Johnson middle for 1 yard (tackle by Damione Lewis)",1,"7M 20S",3,2,1,4.95,3.55,-1.4,FALSE,FALSE,FALSE,FALSE,FALSE,FALSE,FALSE,FALSE,TRUE,"middle"
"Titans","Texans","Kerry Collins pass complete short left to Justin Gage for 1 yard touchdown",1,"6M 45S",4,1,1,3.55,7,3.45,TRUE,FALSE,FALSE,FALSE,TRUE,TRUE,FALSE,FALSE,FALSE,"left"
"Cowboys","Redskins","Jon Kitna pass complete short right to Miles Austin for 3 yards touchdown",1,"4M 14S",1,3,3,6.51,7,0.49,TRUE,FALSE,FALSE,FALSE,TRUE,TRUE,FALSE,FALSE,FALSE,"right"
"Falcons","Seahawks","Michael Turner left tackle for no gain (tackle by David Hawthorne and Colin Cole)",1,"27S",1,7,0,5.6,4.76,-0.84,FALSE,FALSE,FALSE,FALSE,FALSE,FALSE,FALSE,FALSE,TRUE,"left"
"Jaguars","Colts","Maurice Jones-Drew right end for no gain (tackle by Eric Foster and Pat Angerer)",1,"1M 43S",1,1,0,6.97,5.91,-1.06,FALSE,FALSE,FALSE,FALSE,FALSE,FALSE,FALSE,FALSE,TRUE,"right"
"Jaguars","Colts","Maurice Jones-Drew right end for -3 yards (tackle by Gary Brackett)",1,"1M 7S",2,1,-3,5.91,4.49,-1.42,FALSE,FALSE,FALSE,FALSE,FALSE,FALSE,FALSE,FALSE,TRUE,"right"
"Raiders","Broncos","Michael Bush right tackle for 1 yard (tackle by Darcel McBath and D.J. Williams)",1,"4M 2S",1,2,1,6.74,5.91,-0.83,FALSE,FALSE,FALSE,FALSE,FALSE,FALSE,FALSE,FALSE,TRUE,"right"
"Raiders","Broncos","Michael Bush left tackle for 1 yard touchdown",1,"3M 25S",2,1,1,5.91,7,1.09,TRUE,FALSE,FALSE,FALSE,FALSE,FALSE,FALSE,FALSE,TRUE,"left"
"Steelers","Jets","Rashard Mendenhall middle for 2 yards (tackle by David Harris)",3,"9M 46S",1,4,2,6.28,5.72,-0.56,FALSE,FALSE,FALSE,FALSE,FALSE,FALSE,FALSE,FALSE,TRUE,"middle"
"Steelers","Jets","Rashard Mendenhall middle for 2 yards touchdown",3,"9M 7S",2,2,2,5.72,7,1.28,TRUE,FALSE,FALSE,FALSE,FALSE,FALSE,FALSE,FALSE,TRUE,"middle"
"Cowboys","Redskins","Jon Kitna middle for -1 yards (tackle by London Fletcher)",3,"12M 52S",1,2,-1,6.74,5.53,-1.21,FALSE,FALSE,FALSE,FALSE,FALSE,FALSE,FALSE,FALSE,TRUE,"middle"
"Cowboys","Redskins","Tashard Choice right tackle for 3 yards touchdown",3,"12M 11S",2,3,3,5.53,7,1.47,TRUE,FALSE,FALSE,FALSE,FALSE,FALSE,FALSE,FALSE,TRUE,"right"
"Falcons","Seahawks","Jason Snelling middle for 1 yard (tackle by Colin Cole and Lofa Tatupu)",3,"5M 17S",1,8,1,5.37,4.76,-0.61,FALSE,FALSE,FALSE,FALSE,FALSE,FALSE,FALSE,FALSE,TRUE,"middle"
"Falcons","Seahawks","Matt Ryan pass incomplete short left intended for Roddy White",3,"4M 37S",2,7,0,4.76,3.81,-0.95,FALSE,FALSE,FALSE,FALSE,TRUE,FALSE,TRUE,FALSE,FALSE,"left"
"Cowboys","Redskins","Felix Jones left tackle for 1 yard (tackle by Kareem Moore)",3,"5M 33S",1,9,1,5.14,4.57,-0.57,FALSE,FALSE,FALSE,FALSE,FALSE,FALSE,FALSE,FALSE,TRUE,"left"
"Falcons","Seahawks","Matt Ryan pass incomplete short middle intended for Tony Gonzalez",3,"4M 28S",3,7,0,3.81,2.97,-0.84,FALSE,FALSE,FALSE,FALSE,TRUE,FALSE,TRUE,FALSE,FALSE,"middle"
"Cowboys","Redskins","Jon Kitna pass incomplete short right intended for Miles Austin",3,"4M 55S",2,8,0,4.57,3.58,-0.99,FALSE,FALSE,FALSE,FALSE,TRUE,FALSE,TRUE,FALSE,FALSE,"right"
"Falcons","Seahawks","Matt Bryant 25 yard field goal good",3,"4M 25S",4,7,NA,2.97,3,0.03,FALSE,FALSE,FALSE,FALSE,FALSE,FALSE,FALSE,FALSE,FALSE,NA
"Cowboys","Redskins","Jon Kitna pass complete short left to Tashard Choice for 6 yards (tackle by Rocky McIntosh)",3,"4M 49S",3,8,6,3.58,3.25,-0.33,FALSE,FALSE,FALSE,FALSE,TRUE,TRUE,FALSE,FALSE,FALSE,"left"
"Cowboys","Redskins","David Buehler 20 yard field goal good",3,"4M 31S",4,2,NA,3.25,3,-0.25,FALSE,FALSE,FALSE,FALSE,FALSE,FALSE,FALSE,FALSE,FALSE,NA
"Jaguars","Colts","David Garrard pass complete short right to Mike Sims-Walker for 6 yards touchdown",3,"3M 59S",1,6,6,5.83,7,1.17,TRUE,FALSE,FALSE,FALSE,TRUE,TRUE,FALSE,FALSE,FALSE,"right"
"Ravens","Saints","Ray Rice left guard for no gain (tackle by Remi Ayodele and Alex Brown)",3,"3M 7S",1,5,0,6.06,5.15,-0.91,FALSE,FALSE,FALSE,FALSE,FALSE,FALSE,FALSE,FALSE,TRUE,"left"
"Ravens","Saints","Joe Flacco pass incomplete short right intended for Le'Ron McClain",3,"2M 29S",2,5,0,5.15,4.26,-0.89,FALSE,FALSE,FALSE,FALSE,TRUE,FALSE,TRUE,FALSE,FALSE,"right"
"Ravens","Saints","Joe Flacco sacked by Jimmy Wilkerson for -10 yards",3,"2M 25S",3,5,-10,4.26,2.44,-1.82,FALSE,FALSE,FALSE,FALSE,FALSE,FALSE,FALSE,TRUE,FALSE,NA
"Titans","Texans","Javon Ringer left guard for 7 yards touchdown",3,"32S",1,7,7,5.6,7,1.4,TRUE,FALSE,FALSE,FALSE,FALSE,FALSE,FALSE,FALSE,TRUE,"left"
"Vikings","Giants","Tarvaris Jackson pass complete short right to Sidney Rice for 5 yards (tackle by Deon Grant)",1,"6M 13S",2,8,5,4.57,4.72,0.15,FALSE,FALSE,FALSE,FALSE,TRUE,TRUE,FALSE,FALSE,FALSE,"right"
"Vikings","Giants","Tarvaris Jackson pass incomplete short left intended for Sidney Rice (defended by Terrell Thomas)",1,"5M 33S",3,3,0,4.72,3.04,-1.68,FALSE,FALSE,FALSE,FALSE,TRUE,FALSE,TRUE,FALSE,FALSE,"left"
"Vikings","Giants","Ryan Longwell 21 yard field goal good",1,"5M 28S",4,3,NA,3.04,3,-0.04,FALSE,FALSE,FALSE,FALSE,FALSE,FALSE,FALSE,FALSE,FALSE,NA
"Ravens","Texans","Willis McGahee right tackle for no gain (tackle by Zach Diles)",1,"3M 57S",1,1,0,6.97,5.91,-1.06,FALSE,FALSE,FALSE,FALSE,FALSE,FALSE,FALSE,FALSE,TRUE,"right"
"Ravens","Texans","Willis McGahee left guard for 1 yard touchdown",1,"3M 21S",2,1,1,5.91,7,1.09,TRUE,FALSE,FALSE,FALSE,FALSE,FALSE,FALSE,FALSE,TRUE,"left"
"Falcons","Panthers","Matt Ryan pass complete short middle to Tony Gonzalez for 4 yards touchdown",1,"13M 41S",1,4,4,6.28,7,0.72,TRUE,FALSE,FALSE,FALSE,TRUE,TRUE,FALSE,FALSE,FALSE,"middle"
"Eagles","Cowboys","Michael Vick middle for 1 yard touchdown",1,"11M 52S",1,1,1,6.97,7,0.03,TRUE,FALSE,FALSE,FALSE,FALSE,FALSE,FALSE,FALSE,TRUE,"middle"
"Browns","Bills","Peyton Hillis middle for 4 yards (tackle by Paul Posluszny and Donte Whitner)",1,"12M 12S",1,6,4,5.83,5.72,-0.11,FALSE,FALSE,FALSE,FALSE,FALSE,FALSE,FALSE,FALSE,TRUE,"middle"
"Browns","Bills","Peyton Hillis right guard for 1 yard (tackle by Paul Posluszny)",1,"11M 31S",2,2,1,5.72,5.17,-0.55,FALSE,FALSE,FALSE,FALSE,FALSE,FALSE,FALSE,FALSE,TRUE,"right"
"Browns","Bills","Peyton Hillis right guard for no gain (tackle by Chris Kelsay and Donte Whitner)",1,"10M 57S",3,1,0,5.17,3.55,-1.62,FALSE,FALSE,FALSE,FALSE,FALSE,FALSE,FALSE,FALSE,TRUE,"right"
"Browns","Bills","Phil Dawson 19 yard field goal good",1,"10M 14S",4,1,NA,3.55,3,-0.55,FALSE,FALSE,FALSE,FALSE,FALSE,FALSE,FALSE,FALSE,FALSE,NA
"Bengals","Steelers","Carson Palmer pass complete short right to Andrew Whitworth for 1 yard touchdown",1,"10M 2S",1,1,1,6.97,7,0.03,TRUE,FALSE,FALSE,FALSE,TRUE,TRUE,FALSE,FALSE,FALSE,"right"
"Saints","Rams","Drew Brees pass complete short middle to David Thomas for 4 yards (tackle by James Laurinaitis and David Vobora)",1,"9M 7S",2,9,4,4.38,4.26,-0.12,FALSE,FALSE,FALSE,FALSE,TRUE,TRUE,FALSE,FALSE,FALSE,"middle"
"Saints","Rams","Drew Brees pass complete short middle to Marques Colston for 5 yards touchdown",1,"8M 31S",3,5,5,4.26,7,2.74,TRUE,FALSE,FALSE,FALSE,TRUE,TRUE,FALSE,FALSE,FALSE,"middle"
"Falcons","Panthers","Michael Turner left guard for 8 yards (tackle by Sherrod Martin and Jordan Senn)",1,"8M 26S",1,9,8,5.14,5.91,0.77,FALSE,FALSE,FALSE,FALSE,FALSE,FALSE,FALSE,FALSE,TRUE,"left"
"Cowboys","Eagles","Tashard Choice right guard for 2 yards (tackle by Ernie Sims)",1,"7M 2S",1,3,2,6.51,5.91,-0.6,FALSE,FALSE,FALSE,FALSE,FALSE,FALSE,FALSE,FALSE,TRUE,"right"
"Falcons","Panthers","Michael Turner middle for no gain (tackle by Jordan Senn)",1,"7M 46S",2,1,0,5.91,5.17,-0.74,FALSE,FALSE,FALSE,FALSE,FALSE,FALSE,FALSE,FALSE,TRUE,"middle"
"Cowboys","Eagles","Tashard Choice middle for no gain (tackle by Antonio Dixon)",1,"6M 19S",2,1,0,5.91,5.17,-0.74,FALSE,FALSE,FALSE,FALSE,FALSE,FALSE,FALSE,FALSE,TRUE,"middle"
"Patriots","Bears","Tom Brady pass incomplete short middle intended for Deion Branch (defended by Brian Urlacher)",1,"5M 58S",2,7,0,4.76,3.81,-0.95,FALSE,FALSE,FALSE,FALSE,TRUE,FALSE,TRUE,FALSE,FALSE,"middle"
"Cowboys","Eagles","Jon Kitna pass complete short right to Jason Witten for 1 yard touchdown",1,"5M 37S",3,1,1,5.17,7,1.83,TRUE,FALSE,FALSE,FALSE,TRUE,TRUE,FALSE,FALSE,FALSE,"right"
"Patriots","Bears","Tom Brady pass complete short middle to Rob Gronkowski for 7 yards touchdown",1,"5M 52S",3,7,7,3.81,7,3.19,TRUE,FALSE,FALSE,FALSE,TRUE,TRUE,FALSE,FALSE,FALSE,"middle"
"Falcons","Panthers","Michael Turner left tackle for 1 yard touchdown",1,"6M 54S",3,1,1,5.17,7,1.83,TRUE,FALSE,FALSE,FALSE,FALSE,FALSE,FALSE,FALSE,TRUE,"left"
"Saints","Rams","Drew Brees pass incomplete short right intended for Marques Colston (defended by Quincy Butler)",1,"1M 22S",1,3,0,6.51,5.53,-0.98,FALSE,FALSE,FALSE,FALSE,TRUE,FALSE,TRUE,FALSE,FALSE,"right"
"Dolphins","Jets","Ronnie Brown right guard for 3 yards (tackle by Sione Pouha)",1,"3M 33S",1,9,3,5.14,4.95,-0.19,FALSE,FALSE,FALSE,FALSE,FALSE,FALSE,FALSE,FALSE,TRUE,"right"
"Saints","Rams","Pierre Thomas right tackle for 1 yard",1,"1M 17S",2,3,1,5.53,4.95,-0.58,FALSE,FALSE,FALSE,FALSE,FALSE,FALSE,FALSE,FALSE,TRUE,"right"
"Dolphins","Jets","Chad Henne pass incomplete short left intended for Davone Bess",1,"2M 58S",2,6,0,4.95,4.04,-0.91,FALSE,FALSE,FALSE,FALSE,TRUE,FALSE,TRUE,FALSE,FALSE,"left"
"Dolphins","Jets","Chad Henne pass complete short right to Brandon Marshall for 6 yards touchdown",1,"2M 52S",3,6,6,4.04,7,2.96,TRUE,FALSE,FALSE,FALSE,TRUE,TRUE,FALSE,FALSE,FALSE,"right"
"Cowboys","Eagles","Felix Jones right guard for -1 yards (tackle by Trent Cole and Moise Fokou)",3,"8M 32S",1,2,-1,6.74,5.53,-1.21,FALSE,FALSE,FALSE,FALSE,FALSE,FALSE,FALSE,FALSE,TRUE,"right"
"Cowboys","Eagles","Felix Jones right guard for 3 yards touchdown",3,"7M 49S",2,3,3,5.53,7,1.47,TRUE,FALSE,FALSE,FALSE,FALSE,FALSE,FALSE,FALSE,TRUE,"right"
"Cardinals","Broncos","John Skelton pass complete short right to Larry Fitzgerald for 3 yards (tackle by Renaldo Hill)",3,"10M 29S",2,8,3,4.57,4.26,-0.31,FALSE,FALSE,FALSE,FALSE,TRUE,TRUE,FALSE,FALSE,FALSE,"right"
"Cardinals","Broncos","John Skelton pass incomplete short left intended for Larry Fitzgerald (defended by Renaldo Hill)",3,"9M 48S",3,5,0,4.26,3.01,-1.25,FALSE,FALSE,FALSE,FALSE,TRUE,FALSE,TRUE,FALSE,FALSE,"left"
